UserID,Age,Gender,Occupation,MovieID,MovieTitle,Genre,Rating,ReviewText,Timestamp
2213,38,Male,Teacher,733,Compatible bi-directional moderator,Sci-Fi,3.529573449,Pattern recently follow economic stock. Worker report leave me.,20-03-2024 23:42
2214,43,Other,Teacher,190,Polarized solution-oriented complexity,Romance,4.913581221,"Reduce officer mission boy. None whatever there indicate.
By card red somebody amount fact charge.",06-05-2024 06:11
2215,52,Female,Scientist,470,Re-engineered zero administration software,Comedy,4.903651823,Should task name. Remember should interview rule despite ready. Card prepare or return.,05-07-2024 22:23
2216,50,Other,Scientist,617,Networked intermediate open architecture,Sci-Fi,1.66586164,,26-03-2024 23:53
2217,25,Male,Scientist,467,Multi-channeled needs-based encoding,Romance,2.655669499,Per wonder bar beat often think include.,20-03-2024 04:40
2218,46,Male,Engineer,718,Progressive optimal hub,Drama,4.096571972,Thank city be forward necessary. Stop pay heavy stop.,20-01-2024 22:28
2219,54,Female,Teacher,4,Sharable 24/7 function,Comedy,4.880725112,,25-01-2024 16:25
2220,56,Male,Doctor,605,Mandatory impactful encoding,Horror,4.141164589,Idea attack nice order. Among fine Congress sea as.,10-04-2024 22:38
2221,,Male,Scientist,165,Fully-configurable tangible flexibility,Horror,2.573346373,,26-01-2024 09:07
2222,35,Female,Student,949,Focused high-level hardware,Action,4.814416499,,24-05-2024 21:35
2223,56,Other,Doctor,805,Upgradable contextually-based archive,Action,3.778900573,Group say population real baby rich thank. Key statement American current later.,05-03-2024 10:10
2224,52,Male,Doctor,78,Fully-configurable 3rdgeneration attitude,Action,3.718404634,Event still provide world instead. Month decision everyone than. Strategy audience at.,12-01-2024 02:41
2225,27,Male,Scientist,444,Multi-lateral full-range artificial intelligence,Horror,4.480178283,Bad meet manage memory. Still law fine so opportunity hospital. Show control soon require piece.,03-02-2024 07:32
2226,,Female,Doctor,883,Visionary background installation,Action,4.279375248,Create body idea that though. Good church raise local.,09-02-2024 05:09
2227,25,Male,Engineer,30,Devolved global data-warehouse,Comedy,2.618253112,Agent open many American when hope house. Respond blood include those state.,17-05-2024 02:52
2228,32,Female,Artist,882,Face-to-face bifurcated support,Action,1.944212731,Strategy remain it phone former method forward. Again front almost rather about.,30-04-2024 09:15
2229,35,Female,Student,937,Extended 4thgeneration focus group,Sci-Fi,2.655531853,Begin site whose work provide way onto.,30-04-2024 13:39
2230,41,Other,Artist,484,Optimized impactful productivity,Comedy,2.28264742,Ball production party decide report yourself father deal. State each view kind fall could.,28-01-2024 11:32
2231,51,Other,Teacher,686,Ameliorated clear-thinking firmware,Action,3.304087502,,03-07-2024 22:41
2232,58,Female,Student,649,Visionary systematic ability,Sci-Fi,1.938382486,Son brother TV instead identify interesting any. Set four less today.,04-05-2024 10:42
2233,25,Male,Scientist,800,Managed secondary service-desk,Horror,1.181651343,At forward on. One manage board five sea north.,21-06-2024 07:06
2234,31,Other,Engineer,408,Optional empowering support,Romance,1.018046661,Central cell wish simply rise quality simple. Now no beat recognize above.,22-06-2024 20:13
2235,,Other,Student,771,Organic value-added initiative,Horror,4.516131038,He information choose public right. Tax investment believe conference animal security.,08-05-2024 04:45
2236,33,Male,Doctor,548,Up-sized bottom-line process improvement,Drama,3.121981192,Power writer career career smile how two. Population fire build go.,14-05-2024 21:14
2237,31,Male,Artist,96,Total analyzing hardware,Sci-Fi,3.139620648,,01-04-2024 06:17
2238,32,Other,Student,961,Proactive secondary knowledge user,Action,3.149997123,Follow like give year travel. Part thing front.,09-01-2024 20:30
2239,39,Female,Engineer,190,Monitored intangible knowledge user,Drama,,Themselves training new man. Style value bring cut usually girl.,11-05-2024 09:40
2240,33,Male,Student,373,Virtual zero-defect focus group,Drama,3.515163738,Way off community right whether walk. Son not need manager. Great build hear most.,12-01-2024 13:36
2241,33,Female,Student,754,Fundamental disintermediate solution,Drama,1.022512426,Assume kind science over into. Trip also you police eight race care hour. Hot business crime.,16-06-2024 16:25
2242,30,Male,Teacher,119,Centralized multi-tasking emulation,Sci-Fi,2.1285807,Sister international about I PM send improve. Even probably whether ask look.,11-06-2024 21:12
2243,47,Other,Artist,128,Extended bandwidth-monitored synergy,Sci-Fi,2.325345297,Stock as always money.,01-03-2024 03:48
2244,44,Other,Student,762,User-friendly asynchronous extranet,Action,1.754713848,,16-06-2024 04:52
2245,22,Male,Student,374,Open-architected reciprocal methodology,Drama,4.27932987,Guess board power likely. Month usually already.,26-02-2024 16:28
2246,55,Female,Scientist,537,Re-engineered high-level leverage,Action,4.142935956,Nor deal plan threat himself myself meet. Receive sea per agent few above.,04-05-2024 09:25
2247,49,Other,Teacher,821,Virtual demand-driven capability,Romance,3.064338128,Themselves treatment can reveal. Toward me rise. Finally set want assume level.,23-05-2024 22:45
2248,27,Other,Doctor,543,Persevering object-oriented instruction set,Sci-Fi,4.266462407,,26-05-2024 22:07
2249,,Female,Artist,741,Advanced encompassing installation,Romance,3.631665204,Attack can between various cold. Movement pass woman senior choose own.,22-04-2024 21:37
2250,44,Female,Scientist,542,Triple-buffered intangible forecast,Drama,2.911956936,What action more black bar site create. Population them level stop bit name education.,03-04-2024 03:32
2251,41,Other,Doctor,171,Digitized context-sensitive product,Horror,3.261356733,Single fly few site activity. Information analysis development service many others.,16-02-2024 10:58
2252,37,Female,Engineer,136,Front-line optimal monitoring,Horror,3.559261027,Herself participant kid often.,07-03-2024 17:51
2253,48,Male,Doctor,530,Multi-layered global implementation,Action,2.718060046,Point vote stock teacher. Room sport later several lead international.,26-01-2024 23:43
2254,25,Other,Teacher,89,Horizontal explicit process improvement,Romance,,,02-05-2024 08:31
2255,53,Male,Artist,301,Total empowering flexibility,Romance,1.360781571,City foreign conference shake well. International watch often.,03-07-2024 21:17
2256,38,Male,Scientist,966,Universal radical database,Romance,3.896892488,Such every election send no.,20-05-2024 16:33
2257,54,Other,Student,412,Sharable 5thgeneration website,Comedy,2.726227102,Term your religious face agent total best. Top place tend truth lot.,25-05-2024 20:09
2258,58,Male,Engineer,999,Customizable optimizing strategy,Sci-Fi,1.958848905,Happy improve fast. Capital firm commercial prove rather reduce. From say say return carry.,07-01-2024 11:27
2259,54,Female,Student,974,Vision-oriented client-server challenge,Horror,1.675754119,Source customer section president teach. Vote government space expect produce.,18-04-2024 14:27
2260,40,Male,Artist,969,Synchronized fault-tolerant infrastructure,Comedy,3.2168768,,24-03-2024 19:01
2261,53,Male,Scientist,511,Enhanced analyzing collaboration,Action,3.777888431,,09-06-2024 18:53
2262,22,Male,Artist,117,Self-enabling 6thgeneration artificial intelligence,Action,4.120058423,Trial worry member important. What article population against several blue recent both.,25-06-2024 19:01
2263,34,Other,Teacher,734,Adaptive bifurcated alliance,Sci-Fi,2.332435332,Stop art you alone alone.,23-01-2024 10:47
2264,43,Male,Teacher,282,Realigned tangible model,Comedy,2.59253222,Bank always team standard. Democrat Mrs but describe according just success.,24-03-2024 23:20
2265,23,Other,Student,248,Triple-buffered 24/7 customer loyalty,Drama,4.648758575,Risk country individual plan make. Direction prove court seem give improve visit.,14-07-2024 12:29
2266,18,Other,Artist,851,Universal encompassing secured line,Drama,2.869598432,Company break sister consumer shoulder interview. Window common provide scientist.,15-04-2024 19:27
2267,49,Female,Doctor,576,Configurable optimal encryption,Drama,2.770958977,Check how find line newspaper specific. Then couple house may walk show.,07-04-2024 07:35
2268,50,Female,Artist,263,Organic bandwidth-monitored orchestration,Drama,2.847316418,Cause still professor force professor protect. Fly develop threat time.,04-03-2024 00:14
2269,32,Female,Engineer,899,Synergistic intangible migration,Action,1.179735646,,27-03-2024 18:50
2270,54,Female,Artist,279,Right-sized fault-tolerant structure,Sci-Fi,1.7264624,Computer same seven between.,02-06-2024 02:05
2271,47,Other,Scientist,501,Right-sized 24/7 budgetary management,Comedy,3.019723256,True sometimes today guess record. Manager today entire chair hand gun hundred.,02-01-2024 11:02
2272,42,Other,Artist,578,Quality-focused fresh-thinking migration,Romance,4.765927406,Than not modern us. North act positive poor human.,20-01-2024 16:45
2273,,Female,Scientist,156,Reverse-engineered coherent product,Sci-Fi,1.532680922,Business new teacher blood.,09-02-2024 07:37
2274,41,Female,Teacher,447,Switchable didactic hierarchy,Comedy,3.519270101,Environmental trial late heart. Gun seven building safe.,14-07-2024 07:04
2275,21,Male,Scientist,112,Vision-oriented coherent encryption,Horror,3.861352618,Feeling politics child husband clearly. Quality total drop foreign finally.,11-06-2024 11:47
2276,34,Other,Doctor,908,Switchable intangible circuit,Romance,2.613733545,"Money small along field.
Young arrive usually almost. These goal nature product.",22-04-2024 09:03
2277,36,Male,Engineer,292,Automated contextually-based policy,Horror,3.455743934,Though question hear wish.,17-05-2024 04:22
2278,54,Male,Teacher,307,Cross-platform motivating complexity,Comedy,3.972285536,Car image parent. With of help case serious.,22-06-2024 08:03
2279,54,Female,Scientist,812,Compatible multi-tasking capability,Action,3.374873642,Goal far scene player miss matter show. Walk most tree student. Again never same edge.,27-01-2024 09:29
2280,39,Female,Teacher,592,Inverse attitude-oriented application,Horror,1.603446053,Fly great conference total.,14-02-2024 13:33
2281,25,Male,Doctor,418,Profound full-range capacity,Action,4.343704508,Blue trip never camera itself management. Behavior which which ground forward fall but region.,03-01-2024 02:47
2282,37,Female,Scientist,350,Total full-range leverage,Action,4.91481652,Material American month once wrong surface. Front hour nation moment quite former.,23-05-2024 07:01
2283,42,Other,Artist,455,Object-based interactive instruction set,Action,1.72447971,,16-06-2024 11:54
2284,33,Female,Scientist,524,Networked well-modulated knowledge user,Horror,3.905538853,Word inside company. Join live our few couple. High space west change.,26-06-2024 08:16
2285,56,Male,Artist,501,Organic bi-directional paradigm,Drama,1.478031588,It director nearly see. Spend son trouble state southern model water fund.,30-03-2024 05:02
2286,25,Male,Scientist,58,Streamlined zero tolerance model,Romance,2.060725127,Keep either let never effort. Audience measure left enter wish none artist time.,09-02-2024 00:24
2287,21,Male,Engineer,537,Universal mission-critical contingency,Drama,4.444395702,,27-05-2024 07:48
2288,32,Male,Scientist,644,Multi-lateral empowering system engine,Romance,3.752082565,Agree eat technology only. Same so nature way begin well research mean.,09-04-2024 21:22
2289,33,Male,Student,236,Adaptive zero-defect artificial intelligence,Horror,1.193437239,Shake concern machine military citizen. Performance night skin member.,22-06-2024 20:10
2290,49,Male,Teacher,667,Adaptive next generation complexity,Sci-Fi,2.032713453,Out media ever attack within stuff place.,23-03-2024 17:08
2291,36,Female,Scientist,879,Proactive exuding capability,Comedy,3.414708656,Will what discuss unit. Try animal maybe officer. They seem someone far allow street goal.,17-07-2024 18:17
2292,40,Other,Doctor,806,Right-sized tertiary focus group,Romance,1.135985878,Thus onto many. Tonight away control store society focus walk my. Throw arm expect another.,03-07-2024 08:01
2293,37,Female,Engineer,165,Public-key systematic hardware,Drama,4.768280096,Step recently every hear service. Beyond expert draw. Day whatever live think trip similar.,02-02-2024 09:25
2294,21,Male,Artist,780,Self-enabling solution-oriented moratorium,Horror,3.411758023,Set tough wish guy grow. Health city cultural he car. Clear smile spring pressure pressure.,09-01-2024 22:27
2295,21,Female,Scientist,873,Public-key upward-trending knowledge user,Action,1.87710134,Same your themselves set. News police environmental much art or daughter yard.,06-04-2024 17:27
2296,24,Female,Student,757,Programmable dynamic neural-net,Drama,1.92296676,Last traditional dinner get nearly whole head magazine.,25-06-2024 12:52
2297,24,Male,Engineer,727,Robust solution-oriented success,Romance,1.871759766,Rise back toward blood religious fly if. Watch several enter how by protect measure.,17-01-2024 20:01
2298,40,Other,Student,626,Function-based explicit product,Romance,4.417744988,,12-05-2024 13:14
2299,27,Female,Student,572,Devolved full-range encryption,Action,3.805208714,,23-03-2024 09:00
2300,49,Female,Teacher,383,Open-architected stable data-warehouse,Sci-Fi,2.392865262,Them involve memory.,31-03-2024 16:02
2301,19,Male,Student,702,Open-architected mission-critical migration,Action,4.927175754,Commercial daughter them I face can alone. Five pass gas north particularly ground.,25-02-2024 12:21
2302,55,Other,Engineer,170,Exclusive scalable initiative,Drama,4.005741405,Congress team hour drive. Company realize forget recently.,27-02-2024 02:13
2303,56,Other,Artist,518,Cloned impactful emulation,Comedy,3.524676572,Cultural economic sing party couple project have. Road side money total today.,16-02-2024 09:37
2304,53,Male,Engineer,185,Vision-oriented logistical function,Comedy,3.194795344,Heavy traditional investment.,24-03-2024 19:54
2305,39,Male,Doctor,206,Fully-configurable mission-critical protocol,Horror,1.015370303,Blue have rather nice. Or this despite own soldier large.,06-06-2024 12:01
2306,39,Female,Artist,148,Cloned holistic core,Sci-Fi,4.694141959,Condition decide east study man meeting. Nice fill leg decade year middle. Could learn care those.,26-04-2024 15:07
2307,29,Female,Teacher,105,Networked 3rdgeneration moderator,Comedy,4.158427368,Kid most rather six great will note Republican. Ability box size executive risk.,09-03-2024 06:35
2308,21,Female,Student,844,Organized static database,Romance,4.740823224,Pattern interest light while ever wide old. However place staff store.,05-02-2024 21:21
2309,59,Male,Student,12,Pre-emptive static open system,Romance,1.588158822,Thing eat seek able though kind since. Note sing figure man between computer animal.,10-06-2024 02:57
2310,43,Other,Artist,350,Diverse multi-tasking access,Action,4.040033951,Effect yourself girl PM perform exactly. Husband police although these when economic day.,14-01-2024 19:44
2311,51,Female,Teacher,428,Vision-oriented optimizing moderator,Comedy,2.112843858,Word light black former human fast. American do billion.,20-04-2024 11:33
2312,24,Male,Scientist,652,Optimized 4thgeneration system engine,Drama,3.550380892,Plan as war pull no government. Offer size forget current capital.,16-02-2024 11:11
2313,41,Male,Scientist,522,Synchronized next generation focus group,Romance,,,17-07-2024 00:52
2314,44,Female,Student,955,Object-based non-volatile interface,Drama,2.281505844,Program onto nearly participant war discover. Long same yes. Music before hit produce reflect.,02-07-2024 21:27
2315,57,Female,Teacher,784,Reduced high-level process improvement,Action,3.112800249,Office national read your positive guess pick. Mention at experience build mission.,31-03-2024 01:38
2316,19,Other,Doctor,950,Universal composite website,Horror,3.95582281,,12-04-2024 09:00
2317,42,Other,Engineer,982,Synergistic needs-based migration,Drama,4.115070187,Floor final from between organization. Serve and along travel wear. Until box seek break.,15-02-2024 17:37
2318,43,Female,Engineer,488,Total composite access,Sci-Fi,1.440686265,Century forward public soldier how news bad government.,26-01-2024 21:16
2319,,Other,Scientist,822,Re-engineered 24hour Graphic Interface,Action,3.487153202,"Use reach have.
Dog whether cost power service be total. Letter upon boy.",26-06-2024 15:09
2320,22,Male,Doctor,696,Profound scalable moratorium,Horror,3.420832179,Also bag still play federal tell national one. Five now notice ready ask Mrs rise write.,20-05-2024 15:45
2321,24,Female,Engineer,442,Down-sized secondary alliance,Horror,4.605738594,Same leave hope cost head answer. Entire street artist employee.,20-06-2024 19:46
2322,46,Female,Doctor,227,Managed static monitoring,Romance,4.290732791,Fast participant own head phone white ten response. Personal give room court. Certain dark your.,17-03-2024 06:43
2323,49,Male,Teacher,868,Persistent maximized functionalities,Romance,4.362589662,Term situation institution south whole. Give opportunity let anyone how college amount.,01-02-2024 23:10
2324,55,Male,Doctor,317,Enterprise-wide impactful utilization,Romance,2.238016339,Lay wrong finally where several. Truth sense environment charge left magazine.,09-03-2024 10:12
2325,29,Male,Scientist,533,Total national matrix,Comedy,1.489205844,Agent voice across center edge whom.,30-04-2024 13:11
2326,31,Male,Scientist,21,Up-sized client-server paradigm,Sci-Fi,3.177453451,Own real election popular change. Land win model war simple off somebody.,27-06-2024 15:37
2327,21,Male,Artist,592,Open-architected demand-driven info-mediaries,Horror,3.876926921,,12-06-2024 04:20
2328,27,Female,Student,458,Realigned uniform paradigm,Romance,,Maybe and weight career receive. Recently war leave. Hundred receive order realize.,04-03-2024 09:05
2329,47,Female,Teacher,506,Configurable impactful intranet,Sci-Fi,1.440662043,"Phone feeling change wait.
That it size. Image more your dark me push.",22-06-2024 15:15
2330,52,Other,Teacher,646,Profound tertiary application,Romance,3.789594856,Represent as act subject. Value worker officer write career program various.,28-02-2024 22:47
2331,49,Female,Student,575,Business-focused uniform capability,Sci-Fi,1.394213828,For security analysis wall. Imagine later treatment white.,28-06-2024 06:45
2332,34,Male,Teacher,158,Managed client-server approach,Romance,1.006598988,Require skin book everything authority. Trouble at gas call dinner eight.,26-06-2024 01:59
2333,37,Female,Engineer,978,Exclusive tangible conglomeration,Horror,2.495336202,Lay not local. Economic beyond energy fine television. Job city system change cause speak cause.,01-03-2024 14:10
2334,31,Male,Engineer,614,User-friendly attitude-oriented productivity,Action,1.783207357,Each beautiful every determine most land. Debate my yet stand off goal.,15-06-2024 00:35
2335,33,Female,Engineer,834,Customizable grid-enabled encoding,Romance,3.102152361,,28-01-2024 21:10
2336,,Other,Student,510,Sharable uniform framework,Sci-Fi,3.804220789,,05-06-2024 09:23
2337,36,Female,Engineer,242,Innovative full-range functionalities,Action,2.224683825,Allow doctor police skin vote thought listen. Prove book issue. Sure impact enough create.,04-05-2024 15:06
2338,32,Male,Student,550,Organic client-server Internet solution,Horror,2.267749299,"Information assume not. Production local street accept price.
First interest play spend.",04-04-2024 06:40
2339,59,Other,Teacher,130,User-friendly disintermediate ability,Romance,1.06437718,,31-03-2024 01:51
2340,24,Other,Artist,944,Organized uniform installation,Action,3.955536194,Debate argue year human type own various long. Pick third few.,31-03-2024 09:03
2341,44,Other,Engineer,630,Vision-oriented zero-defect benchmark,Romance,4.014409244,"Positive action ahead back own.
Movie less where feeling you research. Plant throw leg.",31-03-2024 05:51
2342,48,Male,Artist,83,Virtual object-oriented project,Horror,4.981411353,Development around notice read power read. Alone performance decision box base direction.,09-01-2024 09:34
2343,58,Female,Scientist,273,Adaptive global moderator,Romance,1.556303871,Movement speech skin late. Wife moment detail easy.,23-03-2024 00:47
2344,43,Female,Engineer,719,Compatible bottom-line access,Action,1.023079123,Success look impact easy raise.,16-07-2024 14:25
2345,24,Other,Scientist,293,Devolved global interface,Action,4.849261214,You because assume organization child since. Strategy standard mean couple they cover.,01-01-2024 14:15
2346,47,Male,Teacher,836,De-engineered object-oriented middleware,Horror,3.870987908,Also base some new such. Model its economic end heavy.,12-06-2024 01:38
2347,21,Other,Doctor,81,Proactive zero administration paradigm,Romance,4.407439023,Popular story still recognize. Stock customer safe arrive whether any too.,27-03-2024 05:25
2348,56,Female,Artist,871,Assimilated heuristic migration,Comedy,3.173575237,But they their sister. Face record both sometimes name.,19-03-2024 04:48
2349,46,Male,Artist,676,Innovative composite leverage,Romance,3.212935858,Along worker energy for house. Amount space agree research. Clear continue development.,21-04-2024 17:47
2350,38,Other,Engineer,57,Organic cohesive help-desk,Drama,2.028218169,Election water threat effort artist finish truth material. Congress book break.,07-06-2024 12:45
2351,38,Other,Doctor,377,Switchable attitude-oriented application,Romance,1.968944851,Partner throw next toward bed.,15-03-2024 10:03
2352,18,Other,Artist,132,Triple-buffered non-volatile groupware,Romance,3.347820258,,01-03-2024 22:53
2353,35,Female,Scientist,139,Total intangible approach,Romance,1.981463505,Central hot after spring from may name. Wide safe collection future loss.,21-04-2024 01:36
2354,20,Female,Teacher,904,Seamless attitude-oriented product,Action,4.959019871,No reality chance kitchen. Media out a step sea simply believe.,25-02-2024 18:49
2355,43,Female,Doctor,69,Total high-level frame,Horror,3.575649651,Adult audience technology. Last different food ground. Both fine heavy better important.,30-06-2024 23:37
2356,39,Other,Teacher,504,Profound bandwidth-monitored flexibility,Sci-Fi,1.823794488,Media he campaign room ability hand. Build customer set bed they whom. Final fall last always.,12-03-2024 12:43
2357,33,Female,Engineer,248,De-engineered neutral hardware,Drama,2.271720347,Machine base school break. Draw trade development then can fact buy.,28-03-2024 10:50
2358,37,Other,Scientist,219,Customizable attitude-oriented open architecture,Action,4.348285024,Responsibility box hand. Professor trade reason.,20-04-2024 08:02
2359,20,Male,Student,322,Public-key cohesive matrix,Comedy,3.662546752,Blood accept stock subject while let. Investment or page lot doctor.,08-02-2024 20:35
2360,52,Other,Scientist,867,Persistent cohesive access,Action,4.696823681,Take remember where like important.,14-07-2024 23:22
2361,50,Female,Doctor,161,Programmable methodical process improvement,Sci-Fi,2.835412243,Experience my threat want help.,25-01-2024 01:19
2362,25,Other,Scientist,984,Upgradable client-driven info-mediaries,Romance,3.540858816,Treat source cultural score. Energy run consider news day mean.,24-01-2024 15:29
2363,29,Male,Artist,506,Multi-layered multi-state methodology,Sci-Fi,4.795209304,Recent until color different determine. Organization movie surface pick.,11-01-2024 07:48
2364,42,Other,Doctor,83,Visionary analyzing policy,Comedy,1.586937749,Our character fact until. Catch fact media current break I move use.,26-06-2024 17:14
2365,25,Male,Artist,607,Ergonomic systemic forecast,Comedy,3.605248517,Every necessary public business huge. Issue suddenly remain writer.,21-05-2024 15:17
2366,25,Other,Teacher,782,Virtual discrete middleware,Sci-Fi,4.332634666,Radio figure two prove cost. Team stage pretty agent personal case wish.,28-05-2024 05:44
2367,32,Male,Teacher,336,Multi-lateral content-based challenge,Romance,3.101370808,Concern door he. Various western stage purpose line kitchen image focus.,02-01-2024 17:39
2368,35,Male,Student,336,Optimized responsive contingency,Drama,3.928087256,Free behind history speak amount. Person its military carry writer. Despite data little matter.,29-05-2024 17:30
2369,22,Male,Artist,52,Cloned client-driven firmware,Comedy,4.512598361,Beautiful positive young source control blood. Why century camera. Move last administration stand.,27-03-2024 23:43
2370,23,Female,Teacher,231,Phased 24/7 approach,Action,2.771686104,Wear investment military office. Report something why dinner factor.,07-04-2024 19:06
2371,50,Other,Teacher,578,Cross-platform clear-thinking open system,Romance,1.870863403,Pretty race lead budget. Thousand garden significant also sound.,26-01-2024 05:09
2372,56,Male,Engineer,446,Profound coherent application,Action,2.970722597,Him only a story. Dream head act line them Congress.,19-07-2024 06:50
2373,25,Female,Engineer,491,Multi-channeled needs-based conglomeration,Horror,4.809579562,,05-07-2024 07:56
2374,39,Female,Teacher,666,Fully-configurable next generation success,Drama,4.638379442,Far amount price he policy price. Say ready recently at.,10-04-2024 23:27
2375,56,Male,Student,404,Realigned demand-driven productivity,Drama,4.322217603,,18-04-2024 12:23
2376,28,Other,Student,607,Public-key fault-tolerant productivity,Drama,1.389687018,Goal effect drive third sense likely. Stage budget agree happy once. Guess low big sea get money.,26-04-2024 23:02
2377,55,Other,Artist,185,Face-to-face coherent Local Area Network,Drama,1.17690226,Risk call no certain floor similar.,08-07-2024 19:19
