UserID,Age,Gender,Occupation,MovieID,MovieTitle,Genre,Rating,ReviewText,Timestamp
1357,20,Other,Doctor,522,Switchable global leverage,Comedy,,Way show really oil threat without positive. Fly third second shoulder.,16-01-2024 03:09
1358,39,Female,Scientist,239,Up-sized 24/7 flexibility,Drama,2.710526415,Lose style rock. Wish structure lead less.,12-07-2024 02:27
1359,44,Female,Engineer,671,Mandatory dedicated standardization,Romance,,,29-05-2024 09:54
1360,51,Female,Scientist,611,Persistent zero-defect migration,Comedy,1.123815689,Again analysis surface the interesting short. Foot rule play will.,28-01-2024 03:23
1361,52,Other,Student,101,Face-to-face discrete process improvement,Romance,2.345186097,Before resource food choose. Friend money break.,08-07-2024 16:56
1362,37,Female,Student,114,Face-to-face real-time process improvement,Romance,3.648294357,Recognize none whom painting billion school marriage. Them ten and. Media garden hour.,05-04-2024 18:27
1363,30,Male,Student,223,Proactive systematic secured line,Comedy,2.352955124,Could call course. System section nearly. Fund real produce affect yet go.,15-06-2024 03:19
1364,56,Female,Artist,885,Organized methodical approach,Comedy,2.192220276,Past sister apply dinner.,27-01-2024 06:26
1365,53,Other,Student,179,Multi-channeled 4thgeneration hardware,Sci-Fi,2.466184797,Education father pressure. Teach personal provide boy. Accept party back never.,12-03-2024 20:34
1366,57,Male,Student,205,Adaptive 4thgeneration collaboration,Horror,1.241123609,"Simply air media.
Do rule today. Back item forget stock budget great.",18-04-2024 07:27
1367,20,Female,Teacher,563,Vision-oriented multi-tasking synergy,Drama,2.447775833,Can beyond evidence catch series. Care mention realize size down those.,07-06-2024 11:22
1368,44,Female,Artist,463,Self-enabling tertiary matrix,Romance,3.062415088,,26-04-2024 09:09
1369,51,Male,Doctor,80,Switchable empowering website,Romance,1.401370334,Back sometimes by. Surface pay good between add image. Watch join sure than the how stage.,06-01-2024 08:57
1370,26,Male,Artist,831,Enhanced homogeneous throughput,Romance,1.548913075,System music still mean truth. Movie onto traditional black them.,19-03-2024 03:24
1371,19,Male,Student,710,Front-line methodical open architecture,Drama,,However training only daughter street maybe cover.,24-04-2024 09:13
1372,44,Female,Doctor,466,Team-oriented dynamic firmware,Romance,2.05990097,Across question his create.,26-05-2024 16:21
1373,33,Male,Scientist,907,Customizable homogeneous focus group,Sci-Fi,1.635653838,,09-02-2024 06:48
1374,22,Female,Teacher,813,Fully-configurable user-facing projection,Sci-Fi,2.81295748,,20-03-2024 10:01
1375,42,Male,Scientist,106,Function-based dedicated toolset,Drama,1.846954475,Month single worker where. Back cost purpose treatment citizen stop anything view.,05-01-2024 09:19
1376,47,Male,Artist,696,Face-to-face foreground groupware,Romance,4.474197644,Eat serious throw law man. Would material itself rather get pretty wonder.,18-06-2024 02:26
1377,32,Female,Scientist,823,Universal non-volatile database,Drama,1.74794924,Customer future cover on. World view toward. His Democrat candidate attack.,06-02-2024 09:13
1378,36,Other,Student,996,Function-based encompassing groupware,Sci-Fi,3.899907935,,28-06-2024 14:16
1379,57,Male,Doctor,354,User-friendly content-based product,Sci-Fi,1.971986384,Interest there American simple by always write. Beautiful page surface million.,30-04-2024 21:58
1380,54,Female,Student,548,Down-sized incremental matrix,Horror,2.346717796,Performance serve second which. Go almost decide leader today.,15-05-2024 03:53
1381,32,Male,Artist,536,Optional responsive info-mediaries,Sci-Fi,2.07639501,I time child new world air point.,18-06-2024 03:32
1382,44,Other,Engineer,879,Digitized value-added matrices,Drama,4.311539612,Blood these about top within alone. Suffer wear identify investment.,20-05-2024 07:37
1383,22,Female,Artist,749,Innovative grid-enabled superstructure,Romance,3.364973889,If product phone. Listen list stay beat threat.,08-01-2024 21:18
1384,36,Female,Engineer,544,Function-based composite instruction set,Horror,3.083695765,Even view important turn. Prevent at evidence commercial enter.,19-03-2024 21:03
1385,31,Other,Artist,262,Intuitive full-range utilization,Horror,3.819241628,Score after would around respond. Economy picture happen put over man could.,09-04-2024 02:20
1386,32,Other,Student,72,Enhanced zero administration definition,Action,2.042165921,,04-01-2024 02:55
1387,54,Female,Artist,896,Switchable mobile system engine,Drama,4.503849831,,03-02-2024 14:40
1388,32,Other,Artist,969,Versatile explicit alliance,Romance,4.043785726,,23-02-2024 17:23
1389,39,Other,Engineer,634,Up-sized reciprocal middleware,Comedy,1.143263515,,12-02-2024 18:27
1390,59,Female,Doctor,748,Cloned didactic framework,Action,2.144759857,Those foot bank reveal. Until age shoulder low detail maintain. Write network turn leg.,29-03-2024 09:33
1391,39,Male,Teacher,685,Multi-channeled 24hour paradigm,Drama,3.366705428,Federal develop believe present various on. Window few leave show person military policy the.,18-01-2024 18:03
1392,54,Other,Artist,96,Grass-roots mission-critical encryption,Romance,4.517456982,Hand sport language. Cultural save none play finish. Hold act out learn.,29-03-2024 00:03
1393,53,Female,Scientist,617,Phased client-server hardware,Drama,3.979939367,Prove public use cause first recent later nice. Other range think particularly executive.,14-03-2024 01:00
1394,31,Male,Teacher,223,Managed heuristic success,Romance,2.87643322,Physical today thus yes institution. Project hope themselves investment which author popular.,23-01-2024 06:49
1395,30,Male,Teacher,748,Down-sized radical infrastructure,Action,3.617075254,,03-01-2024 00:44
1396,40,Other,Scientist,591,Cross-group value-added attitude,Action,4.035252804,"Doctor once husband like report figure.
Authority fast after adult career.",12-05-2024 22:12
1397,25,Female,Scientist,978,Robust incremental monitoring,Action,4.375763039,,07-01-2024 03:35
1398,57,Male,Engineer,199,Cross-group multi-state service-desk,Romance,4.140101144,Rule production south wonder camera. Boy tonight region follow.,21-06-2024 10:06
1399,21,Other,Student,60,Virtual asymmetric utilization,Action,2.964671581,,13-07-2024 17:31
1400,59,Male,Teacher,587,Optimized dynamic success,Comedy,3.529104035,President commercial work country make compare. Message interest morning evidence.,06-02-2024 15:20
1401,51,Other,Student,147,Automated disintermediate initiative,Drama,2.819516905,Blue show hundred. Think stage word indeed idea various.,27-03-2024 14:45
1402,48,Other,Student,977,Quality-focused client-driven projection,Action,2.830785657,Job these look TV. Deal window fund consider.,23-05-2024 00:42
1403,50,Male,Doctor,979,Advanced systematic Internet solution,Action,3.9288474,Which human station stop. Have natural more. Other however candidate speak easy career peace.,16-04-2024 05:02
1404,23,Female,Artist,525,Networked client-driven functionalities,Action,2.202330052,Best indeed recently turn practice. Blue break expect these.,23-03-2024 08:11
1405,56,Other,Student,541,Balanced encompassing array,Action,1.7336771,,12-06-2024 19:38
1406,38,Male,Teacher,374,Synergized intangible array,Horror,1.080466281,Continue only share. During goal way city. Garden push job gun leave than show.,05-05-2024 13:04
1407,41,Male,Student,864,Organized zero-defect parallelism,Horror,1.114040966,Choose include kitchen quickly much. Ahead they approach weight necessary international.,01-04-2024 00:32
1408,38,Female,Doctor,267,Exclusive grid-enabled knowledge user,Romance,4.544777939,,03-04-2024 07:06
1409,19,Male,Teacher,616,Reduced 24/7 open architecture,Romance,3.805157559,Organization tell significant bag benefit. Great dream more chance Republican inside explain.,13-04-2024 08:12
1410,32,Other,Teacher,233,Inverse attitude-oriented Internet solution,Horror,4.420862935,Adult agent already win. People keep popular. Model law you can attack fill art three.,09-05-2024 20:51
1411,46,Male,Teacher,41,Robust optimal groupware,Action,4.833678736,Travel turn late read fear population. Suffer report reason century tough.,02-06-2024 14:15
1412,22,Male,Engineer,209,Centralized bandwidth-monitored algorithm,Action,4.929757868,,17-07-2024 16:04
1413,45,Other,Doctor,536,Compatible fresh-thinking core,Comedy,2.867450186,Tax small section spring edge act about continue.,11-05-2024 18:06
1414,,Other,Student,41,Implemented disintermediate extranet,Action,3.582320272,Very black reduce daughter choose majority heavy decide. Word girl dinner public public hope.,30-06-2024 16:27
1415,26,Other,Engineer,175,Reduced stable application,Comedy,3.288116787,,28-06-2024 10:38
1416,43,Male,Doctor,203,Inverse stable challenge,Action,4.745253374,,28-05-2024 06:28
1417,27,Male,Doctor,713,Re-contextualized human-resource algorithm,Horror,1.004691352,"On whom through purpose later.
Assume continue blood success or perhaps.",06-04-2024 20:33
1418,20,Female,Artist,824,Business-focused holistic focus group,Action,1.115697001,American other my. Air with former generation. Difficult lawyer phone stage dog.,26-06-2024 10:56
1419,58,Female,Artist,204,Networked intangible concept,Drama,2.924485145,Kid course security scientist. Fall admit statement financial practice few range worry.,21-01-2024 09:17
1420,27,Male,Engineer,559,Synchronized background task-force,Sci-Fi,,Suggest oil single work buy reason. When side full car. No various home run.,01-06-2024 22:30
1421,,Female,Scientist,510,Persevering incremental archive,Action,1.042080521,Play can environment should. Apply minute question however continue.,09-01-2024 16:43
1422,23,Male,Student,738,Managed next generation emulation,Comedy,4.917096247,Organization fast step article those last. There set recent decade fall term child interest.,26-02-2024 23:25
1423,49,Male,Scientist,933,Devolved interactive architecture,Romance,4.141398061,More decade leg need. Heavy themselves coach smile structure heart people.,16-06-2024 05:14
1424,30,Male,Scientist,353,Monitored discrete info-mediaries,Sci-Fi,1.392703285,True still owner yet. Into strong idea maintain serious.,14-03-2024 09:43
1425,28,Other,Doctor,295,Innovative high-level open architecture,Sci-Fi,,Seem show opportunity result full deep else. Herself cover white.,06-06-2024 06:23
1426,58,Other,Scientist,621,Profound empowering workforce,Horror,4.972960689,Late step election economic half people.,27-02-2024 18:48
1427,31,Female,Student,481,De-engineered local strategy,Romance,1.066652822,Million include which ground trial.,27-03-2024 23:16
1428,40,Female,Teacher,865,Automated value-added success,Horror,3.384187732,Thousand allow herself well modern. Wind where next cup.,05-06-2024 09:09
1429,42,Male,Engineer,666,Managed dynamic circuit,Action,1.994376101,,22-02-2024 14:35
1430,43,Other,Artist,291,Inverse disintermediate workforce,Comedy,3.079017637,Mouth effort song much. Good now important reach bit ball.,21-03-2024 17:46
1431,59,Other,Student,926,Inverse executive matrices,Horror,3.9993797,,18-05-2024 08:04
1432,51,Male,Engineer,942,Assimilated 6thgeneration encryption,Sci-Fi,1.303097431,Source a notice lead. Direction key ten believe five east.,01-01-2024 18:36
1433,39,Female,Engineer,176,Switchable methodical policy,Romance,4.835230717,Pattern what ready fish. Republican drop certainly remain break wide explain boy.,16-03-2024 22:30
1434,28,Female,Artist,484,Inverse optimal benchmark,Action,3.885103291,"Third window article ten including across.
Interesting hope will. Physical still time.",20-07-2024 09:21
1435,31,Male,Doctor,608,Sharable 24/7 encoding,Horror,,What pressure name after tell against. Only every technology employee party.,16-07-2024 13:10
1436,22,Female,Student,645,Programmable exuding conglomeration,Action,1.287669406,,06-07-2024 02:19
1437,31,Male,Scientist,38,Organized bi-directional implementation,Sci-Fi,,,12-01-2024 18:00
1438,23,Male,Artist,469,Re-engineered analyzing migration,Action,3.697021888,Them defense serve while movie table itself. Movie there learn month.,19-04-2024 18:04
1439,24,Other,Student,289,Function-based 3rdgeneration monitoring,Drama,3.392515911,Ahead west story end. Second foot old record authority six. Break help according include.,17-01-2024 02:57
1440,,Female,Engineer,375,Synergized 6thgeneration complexity,Comedy,4.361564647,Direction finally right woman center region. Speech herself money develop describe side us.,16-01-2024 22:32
1441,27,Other,Engineer,595,User-friendly attitude-oriented pricing structure,Sci-Fi,2.621203365,Many expert story form. Executive one six coach environment. Enough walk them police affect.,18-02-2024 08:37
1442,47,Female,Doctor,263,Adaptive bifurcated Internet solution,Action,3.698551469,Hospital week single hundred material.,10-02-2024 22:04
1443,49,Female,Engineer,426,Advanced intermediate matrices,Sci-Fi,2.658646083,,20-04-2024 02:27
1444,38,Male,Student,862,Organic directional methodology,Action,2.107056094,Can choose good truth continue might gas. Sometimes expert receive his arrive remember.,31-01-2024 07:54
1445,43,Other,Scientist,93,Upgradable global budgetary management,Sci-Fi,3.364047626,Experience ground out management future. Design term involve series increase he old.,17-05-2024 15:47
1446,36,Female,Teacher,203,Horizontal human-resource matrices,Drama,3.585310815,Official benefit same step great of especially. Front interview change paper.,09-07-2024 21:03
1447,52,Other,Doctor,183,Quality-focused transitional portal,Sci-Fi,4.088064495,Without policy vote time indicate range. Most week still.,18-07-2024 18:33
1448,53,Female,Engineer,349,Extended composite architecture,Horror,2.921760744,Occur region clearly medical claim. It culture guess.,09-03-2024 06:53
1449,28,Male,Scientist,827,Extended uniform approach,Sci-Fi,4.243777661,Agreement hot magazine dream positive skin company. Stop hold grow sometimes view modern.,02-05-2024 16:29
1450,45,Other,Student,52,Upgradable scalable success,Drama,3.333240149,Leg detail owner. Present attention attention.,14-06-2024 13:24
1451,24,Male,Doctor,573,Quality-focused high-level benchmark,Sci-Fi,4.168363237,,09-04-2024 03:24
1452,24,Other,Engineer,357,Visionary full-range encryption,Comedy,4.567527695,Moment future spring range base matter able I. Report voice pressure my maintain dream.,13-06-2024 13:31
1453,22,Other,Doctor,590,Customizable contextually-based matrix,Romance,3.999023001,Kid word agent this ago. Work commercial listen yourself. Allow specific single above meet.,29-02-2024 04:11
1454,33,Male,Student,97,Configurable dynamic process improvement,Sci-Fi,1.169936957,,08-07-2024 08:27
1455,,Other,Student,816,Advanced modular benchmark,Action,1.319552507,Entire probably mouth answer whose rock.,24-06-2024 01:29
1456,20,Other,Teacher,462,Total human-resource process improvement,Sci-Fi,1.548627276,Recognize adult later audience. Pm attorney listen enter interview.,21-05-2024 17:49
1457,50,Female,Scientist,369,Object-based high-level application,Horror,,Example fear matter upon care chair.,24-05-2024 17:38
1458,47,Other,Doctor,481,Centralized clear-thinking capability,Action,2.636141619,Seek near process central food room trial. Think surface young else prepare nor sort.,10-07-2024 04:06
1459,28,Female,Student,974,Triple-buffered scalable encoding,Horror,4.65521739,Still prove main white. Family family work buy air cup war. Say various choice.,06-07-2024 12:37
1460,19,Other,Scientist,649,Grass-roots fault-tolerant architecture,Action,3.922561664,Rate woman art system would less level. To include modern major participant pass state training.,02-06-2024 16:39
1461,19,Other,Artist,335,Reduced attitude-oriented capacity,Horror,1.297416637,Real her back really. Art agree develop rule. Candidate grow leg police well individual thing.,14-03-2024 19:06
1462,43,Female,Teacher,253,Enterprise-wide foreground hardware,Romance,3.008308753,Will research significant need many. Between know available bill drug natural walk.,11-06-2024 00:04
1463,35,Other,Teacher,827,Upgradable demand-driven knowledgebase,Drama,1.092841914,These speech institution yes however glass.,13-03-2024 14:20
1464,29,Female,Doctor,943,Synergistic modular Graphical User Interface,Drama,3.537765672,,28-06-2024 23:41
1465,45,Male,Engineer,777,Progressive composite contingency,Horror,4.173332096,Whom truth ahead require. Join bank fact sure accept individual loss.,13-07-2024 03:59
1466,50,Male,Student,252,Sharable dedicated parallelism,Drama,3.452143124,,20-06-2024 04:05
1467,41,Other,Student,469,Switchable optimal knowledgebase,Comedy,2.404384428,Kind Democrat middle case yet although. Girl table building section spend walk buy.,26-06-2024 11:12
1468,29,Other,Student,926,Ameliorated zero administration functionalities,Comedy,4.407209128,,22-04-2024 06:47
1469,43,Male,Student,854,Compatible maximized website,Romance,1.256648322,Accept form support receive scientist player. Again drive may south by believe type.,03-02-2024 08:17
1470,19,Female,Doctor,609,Function-based logistical archive,Romance,,Suffer education protect low trouble analysis mouth. Draw one heavy he thank marriage.,14-01-2024 05:03
1471,54,Other,Teacher,916,Adaptive fault-tolerant benchmark,Comedy,3.460621417,Total interesting statement about might three second. Account green better performance road view.,28-05-2024 16:37
1472,51,Female,Doctor,360,Down-sized secondary access,Sci-Fi,2.277125884,,20-01-2024 21:21
1473,42,Other,Artist,487,Programmable responsive standardization,Comedy,1.748129517,Mean trip watch thought difference. Brother wife growth inside today nothing.,14-04-2024 16:16
1474,54,Female,Teacher,786,Enterprise-wide optimizing capacity,Sci-Fi,1.732771371,,18-05-2024 12:42
1475,49,Other,Artist,363,Open-source interactive complexity,Comedy,3.730545662,Like item arrive age part. Drop data hundred anything million week suggest. Blue partner cause.,17-06-2024 04:59
1476,48,Other,Doctor,663,Customer-focused leadingedge moderator,Comedy,1.366353823,Open seat interview major name tell. Meet walk enjoy decision.,07-03-2024 16:29
1477,58,Female,Scientist,66,Object-based eco-centric moderator,Action,4.166622676,Arrive box one. Majority story will set court message.,19-07-2024 18:53
1478,50,Female,Scientist,695,Advanced bandwidth-monitored solution,Drama,3.521630161,Turn hope wind despite behind. Drug realize film. Act job if unit push.,02-02-2024 22:26
1479,36,Other,Scientist,279,Re-contextualized national capability,Action,3.326000023,,15-07-2024 19:46
1480,37,Female,Student,688,Assimilated content-based artificial intelligence,Sci-Fi,1.632949831,Want single tell beautiful. Argue pay six his source contain chair. Speak nearly friend chair day.,18-01-2024 03:35
1481,25,Other,Teacher,488,Extended mission-critical function,Action,3.228693138,Choose eight skill. International floor general experience.,01-06-2024 17:40
1482,51,Male,Engineer,774,Networked foreground core,Action,3.57827902,Despite skill president west adult. Painting radio mention say television road clear.,17-05-2024 21:17
1483,50,Male,Artist,917,User-centric optimal solution,Drama,1.756257294,,03-05-2024 22:11
1484,,Female,Student,57,Front-line directional parallelism,Comedy,4.471005448,Event PM them soon offer. Than medical similar open goal defense.,29-04-2024 00:42
1485,,Male,Student,887,Business-focused leadingedge middleware,Drama,4.21122326,Back choose community. Event wrong thank worry capital much subject product.,01-03-2024 17:58
1486,48,Male,Scientist,118,Networked optimizing hardware,Sci-Fi,4.652573854,Glass daughter minute.,31-01-2024 09:54
1487,33,Male,Student,475,Face-to-face attitude-oriented concept,Action,1.929475754,Cultural special nothing thousand total participant. Where tough visit sure message.,19-06-2024 11:59
1488,40,Male,Teacher,381,Upgradable regional complexity,Drama,3.072233836,Improve glass until during. Newspaper until attack view.,09-01-2024 01:27
1489,46,Male,Artist,372,Organic analyzing framework,Horror,1.709748908,Others investment learn firm. Such stop new sell eye.,06-02-2024 15:20
1490,25,Other,Student,392,Fully-configurable zero-defect product,Sci-Fi,3.773316619,Relationship finish color include among item. Fish speak break walk every majority.,11-02-2024 17:23
1491,46,Male,Scientist,937,Visionary zero-defect flexibility,Action,1.727042343,Join past service maybe. Produce the character protect audience.,13-04-2024 06:50
1492,46,Female,Doctor,507,Virtual asymmetric parallelism,Action,2.009723939,Where culture stop rock office picture special. During resource bad manage.,28-03-2024 11:44
1493,47,Other,Teacher,918,Team-oriented exuding encoding,Romance,1.017045601,According couple have hotel. Why particular win oil sign guess. Third financial window.,02-07-2024 10:27
1494,50,Other,Engineer,521,Digitized impactful hub,Romance,4.057622183,Against economic develop yeah. Center soon play space owner federal over.,20-02-2024 08:51
1495,54,Male,Artist,679,Open-architected asymmetric website,Drama,3.351032888,Outside sometimes simple will in. Democrat husband possible open interview.,02-02-2024 05:24
1496,27,Other,Doctor,564,Object-based regional product,Horror,1.898870825,"Large either company degree former full.
This building week win. Large compare fact special.",23-01-2024 17:28
1497,27,Female,Scientist,551,Balanced disintermediate emulation,Comedy,,Part next record hair. Security right our two. Cold answer past.,06-07-2024 11:50
1498,53,Female,Scientist,274,Customizable explicit customer loyalty,Horror,1.856172665,Media city avoid walk. Director treatment professional reach marriage.,09-01-2024 20:20
1499,56,Male,Student,131,Profit-focused cohesive solution,Drama,4.495660062,White letter back season between. Along line get movement ever sense.,12-05-2024 14:43
1500,32,Other,Engineer,981,Re-contextualized well-modulated migration,Drama,2.474106891,Carry ahead item election follow. Billion happy deep.,20-01-2024 21:07
1501,54,Female,Artist,629,Ameliorated well-modulated project,Horror,3.679379305,Prove building edge task particular song issue fish.,28-03-2024 09:15
1502,,Other,Scientist,357,Visionary neutral Graphic Interface,Action,,Improve final ready myself.,15-05-2024 04:50
1503,46,Male,Doctor,2,Multi-lateral local pricing structure,Romance,4.977531763,Least notice recent forward. While as manager. Pressure bring in person herself design.,19-04-2024 20:43
1504,44,Female,Student,725,Exclusive user-facing core,Horror,,Moment most land push. Send court others young senior fly thus.,04-01-2024 00:31
1505,30,Male,Scientist,900,Vision-oriented 4thgeneration system engine,Action,4.34306158,Develop stuff thought. Security job degree wind light.,13-03-2024 14:24
1506,49,Female,Scientist,989,Monitored responsive product,Sci-Fi,,Certainly color much scientist. Become heart seek.,15-07-2024 16:22
1507,30,Male,Artist,127,Vision-oriented local projection,Action,2.244327959,,19-03-2024 15:44
1508,18,Other,Teacher,474,Cloned asynchronous portal,Drama,2.066566976,,29-05-2024 14:28
1509,39,Female,Doctor,245,Configurable optimal approach,Drama,2.553700999,,19-07-2024 10:25
1510,45,Other,Teacher,968,Reverse-engineered well-modulated interface,Horror,2.68773184,Week listen professor carry record owner. Sure agent foreign interesting her decision answer.,26-06-2024 14:06
1511,52,Other,Engineer,129,Enterprise-wide multimedia middleware,Drama,3.167567091,Course finish red statement find at. Mouth town paper whom hotel very follow. Work goal vote whom.,18-04-2024 07:06
1512,48,Other,Artist,647,Visionary object-oriented help-desk,Horror,,Result money above fill character.,04-01-2024 00:46
1513,38,Other,Doctor,718,Networked solution-oriented success,Drama,4.005069533,"What performance money rise decade. Population approach section key.
Public choice moment cover.",17-04-2024 00:58
1514,51,Male,Engineer,287,User-centric user-facing functionalities,Action,1.516550602,Resource share provide let left.,08-03-2024 20:26
1515,55,Male,Doctor,854,Business-focused bi-directional groupware,Action,4.479393467,None dinner compare course rather see. Only a others radio yes parent.,08-04-2024 05:06
1516,45,Other,Student,438,Function-based hybrid contingency,Comedy,,,07-01-2024 09:07
1517,57,Other,Doctor,667,Inverse secondary circuit,Horror,1.229120515,,08-03-2024 05:34
1518,32,Other,Engineer,878,Compatible object-oriented parallelism,Romance,1.705748719,Machine better address. Study performance understand next out mind top.,06-06-2024 21:07
1519,47,Other,Artist,459,Devolved radical protocol,Drama,2.064604907,Tell paper beyond. Reflect finally station fine better.,11-02-2024 06:06
1520,29,Male,Doctor,446,Secured needs-based algorithm,Action,3.671176677,Girl feel miss. Plan role walk happy. Chair leave ok worry health. Tv Democrat force certain.,22-02-2024 21:42
1521,20,Other,Engineer,320,Distributed client-driven analyzer,Sci-Fi,1.417827003,Head several century run. Think leader benefit ago image him movement industry.,24-02-2024 18:39
1522,41,Other,Student,10,Versatile user-facing archive,Comedy,1.279382808,Fish everyone remember stand figure mission water magazine.,14-04-2024 13:38
1523,23,Male,Doctor,692,Multi-channeled exuding migration,Comedy,2.221452218,Into knowledge time apply system. Break safe start test.,12-06-2024 14:50
1524,51,Male,Student,338,Function-based eco-centric migration,Horror,4.93397699,Artist ready medical easy hot enter.,12-04-2024 10:15
1525,49,Female,Student,212,Managed leadingedge success,Action,4.349415387,,04-07-2024 10:42
1526,46,Male,Artist,898,Visionary tangible system engine,Sci-Fi,1.206148258,,20-03-2024 22:26
1527,49,Male,Scientist,267,Re-contextualized background parallelism,Sci-Fi,4.478422762,,02-02-2024 20:17
