UserID,Age,Gender,Occupation,MovieID,MovieTitle,Genre,Rating,ReviewText,Timestamp
688,46,Other,Student,857,Multi-layered static access,Drama,1.730586996,Though recognize probably term daughter. Involve off to. Sense lay couple full.,06-04-2024 03:42
689,23,Male,Scientist,648,Monitored object-oriented orchestration,Drama,2.320647637,Which television trouble staff. Half eat analysis eye themselves expect charge.,08-02-2024 19:41
690,31,Female,Doctor,763,Reverse-engineered web-enabled knowledge user,Romance,4.100944738,"Far form name father boy only summer. Business focus each actually white.
Down speech it prove.",03-03-2024 13:16
691,32,Male,Teacher,183,Reverse-engineered static array,Horror,2.176417446,Serious live key expert remain. Dog perhaps guy.,03-05-2024 20:16
692,33,Other,Scientist,41,Advanced stable time-frame,Sci-Fi,4.126242933,Put sometimes big actually national could loss. Present his generation describe.,14-02-2024 21:09
693,32,Male,Doctor,146,Diverse solution-oriented analyzer,Drama,4.781884588,,25-06-2024 03:46
694,34,Female,Teacher,712,Implemented dynamic matrices,Horror,1.646397217,Billion these even process of glass back. Create well goal say until chair.,08-03-2024 17:29
695,18,Female,Artist,174,Programmable user-facing secured line,Comedy,4.091337083,Rule well build eight behavior hold go. Population herself return.,02-06-2024 05:45
696,36,Male,Engineer,936,Face-to-face 3rdgeneration task-force,Comedy,3.074236728,Shoulder clear mention able rather learn. Officer never thing too court become.,07-06-2024 22:09
697,50,Female,Doctor,888,Open-source 6thgeneration algorithm,Romance,4.242886274,Media player resource toward crime.,01-04-2024 00:10
698,,Other,Student,423,Digitized bottom-line protocol,Action,2.59303438,,05-04-2024 08:18
699,,Other,Engineer,259,Ergonomic optimizing alliance,Sci-Fi,2.518006131,Fall task source son build. Trade event boy small.,10-07-2024 05:45
700,20,Male,Engineer,617,Self-enabling uniform implementation,Romance,3.230101826,Responsibility spend take. Interest role age TV its and Mr.,01-07-2024 06:48
701,41,Male,Teacher,453,Centralized scalable adapter,Drama,4.131799602,Son find write culture. Dinner cause cost concern particularly field green.,24-05-2024 08:53
702,49,Male,Student,333,Reduced multi-tasking Graphic Interface,Horror,2.847465783,Generation with affect moment manager myself inside. Note significant air church start into single.,23-01-2024 01:08
703,36,Male,Engineer,207,Virtual global database,Action,4.671067878,Today organization mention he. Long let lead around.,22-05-2024 19:46
704,39,Female,Student,726,Public-key responsive solution,Drama,3.365090152,Simple nice man well. Natural company fish.,10-02-2024 09:27
705,18,Other,Doctor,178,Triple-buffered background flexibility,Comedy,1.710475175,Head phone entire join year good. May lose later others.,03-06-2024 14:44
706,55,Other,Artist,963,Progressive even-keeled budgetary management,Drama,4.620410625,"Business be stay news thing center growth star. Parent ground cost analysis.
Study laugh fact oil.",17-03-2024 05:37
707,59,Male,Artist,223,Innovative mission-critical open system,Romance,2.974781646,School prepare key write situation production staff.,23-02-2024 08:56
708,24,Male,Student,59,Sharable empowering moderator,Comedy,2.672262174,Method again staff knowledge next. Note assume drug central.,01-07-2024 02:56
709,34,Female,Doctor,449,Implemented asymmetric middleware,Comedy,2.894732029,,27-05-2024 01:46
710,42,Other,Doctor,201,Cross-group dynamic application,Romance,1.099731038,Yourself stand especially style effect. By stage either know pass. Nation work begin word.,06-06-2024 17:38
711,19,Female,Scientist,128,Configurable disintermediate customer loyalty,Comedy,3.428309107,"Media study over nice prove.
Politics own former hundred trip send. Sense goal certainly result.",07-02-2024 12:33
712,43,Other,Scientist,324,Ergonomic modular approach,Action,2.5082201,,14-05-2024 03:25
713,41,Male,Student,945,Function-based global architecture,Comedy,3.926685922,Republican edge worker. Someone hear what heart.,01-04-2024 21:45
714,55,Female,Teacher,918,Diverse systemic Local Area Network,Drama,2.388655664,,21-05-2024 17:45
715,29,Female,Scientist,246,Enhanced mobile database,Sci-Fi,3.398322445,Meet left including decision college write.,13-04-2024 06:57
716,31,Female,Doctor,46,Centralized contextually-based algorithm,Sci-Fi,4.573811293,School training become effect least. Radio easy raise race training bad feel.,28-01-2024 04:40
717,46,Female,Student,354,Profound responsive database,Drama,1.325790727,Particularly example analysis. Hand apply before seat. End politics today chance avoid food bring.,05-04-2024 11:51
718,21,Male,Doctor,959,Multi-layered well-modulated access,Action,3.822960275,Father involve product. Drive I space especially art sea trouble continue.,16-01-2024 06:22
719,36,Other,Doctor,648,Front-line systematic software,Horror,4.879404549,Thought choose economic report across. Simply fall car place mission glass.,21-05-2024 16:16
720,57,Male,Student,633,Customizable heuristic orchestration,Sci-Fi,4.657385404,Get these across lead cultural. Station may guy result morning.,07-01-2024 02:14
721,32,Female,Artist,456,Enterprise-wide web-enabled database,Romance,1.595594123,Fall explain change third. Else computer surface involve.,12-02-2024 13:11
722,34,Male,Engineer,614,Open-source secondary toolset,Action,4.138621307,Structure Mr study then election.,12-04-2024 02:52
723,44,Male,Artist,578,Centralized intangible implementation,Romance,3.528395728,Body she part. East though list anyone. Task of leg kind.,06-06-2024 11:55
724,44,Male,Scientist,780,Expanded hybrid open system,Romance,2.67516061,Look late Mr structure rise spend. Every next stuff second.,15-04-2024 22:30
725,48,Female,Artist,900,Team-oriented even-keeled groupware,Romance,2.85332942,Third buy purpose cause case easy. Floor coach look.,27-02-2024 03:41
726,32,Other,Scientist,577,Right-sized 5thgeneration conglomeration,Action,3.02297735,Air too hotel pay season explain. Method kitchen treat result. Where such relate.,20-02-2024 21:58
727,30,Male,Teacher,719,Cross-group national framework,Sci-Fi,3.631782486,,06-03-2024 01:57
728,31,Other,Student,842,Programmable scalable Graphic Interface,Drama,2.527660431,Stuff fill chair. Above research piece support. Century unit clearly street beautiful.,20-06-2024 09:30
729,54,Female,Engineer,164,Polarized zero-defect hardware,Romance,1.055327244,,04-03-2024 12:12
730,29,Female,Student,206,User-friendly impactful help-desk,Comedy,3.280080728,"Mother half deal. Trial ability minute follow fire wear put.
Blood interview create know us mind.",16-01-2024 10:09
731,54,Female,Engineer,404,Balanced responsive framework,Comedy,2.805065026,Write seem contain analysis. Cover hard around occur.,24-02-2024 01:39
732,41,Male,Engineer,882,Front-line systematic extranet,Action,1.644969259,For to finally than. Whether nearly deep instead general. Area light return nice simple red she.,21-02-2024 19:30
733,25,Other,Student,40,Switchable zero tolerance middleware,Sci-Fi,1.553259402,Staff pull technology according war industry. Half commercial likely assume general manage.,13-06-2024 15:29
734,49,Other,Scientist,903,Up-sized reciprocal firmware,Comedy,3.591995492,,16-04-2024 15:51
735,31,Female,Engineer,247,Compatible homogeneous application,Romance,4.757387952,,10-04-2024 09:33
736,44,Other,Artist,492,Multi-channeled uniform frame,Horror,4.061117255,Ago idea mother option especially each author. Part government result lot relationship indeed sign.,17-05-2024 05:39
737,54,Female,Student,93,Cloned bifurcated time-frame,Drama,4.048205536,,18-02-2024 12:19
738,20,Other,Doctor,980,Networked 24hour implementation,Comedy,,,24-06-2024 07:14
739,58,Other,Teacher,397,Reactive systemic middleware,Romance,4.132599924,,09-04-2024 07:21
740,27,Male,Engineer,986,Compatible explicit leverage,Drama,4.324983014,Section citizen itself not along work make there. Bag space speech score star store right.,13-07-2024 02:49
741,32,Male,Student,375,Enterprise-wide user-facing projection,Horror,3.716949957,Own include item become. Down ground between training serve above.,02-01-2024 07:44
742,50,Other,Doctor,922,Open-source zero tolerance productivity,Comedy,3.481157955,Few plant role else someone job local. Thus kid their prevent.,29-04-2024 05:15
743,55,Female,Engineer,79,Persevering executive database,Sci-Fi,4.070592645,,15-06-2024 15:34
744,40,Female,Engineer,953,Profound eco-centric functionalities,Drama,2.275873451,,13-01-2024 04:23
745,48,Female,Doctor,739,Optimized non-volatile neural-net,Drama,1.912100747,Old pass condition easy. Future very better whole project it kind doctor.,19-03-2024 20:56
746,22,Other,Scientist,723,Centralized multi-tasking benchmark,Action,2.380359439,,03-04-2024 05:06
747,30,Female,Teacher,520,Focused optimizing knowledgebase,Action,2.3433163,Walk hour before else most only world eye. Production school us citizen strategy stock whether.,21-03-2024 23:28
748,20,Male,Scientist,41,Horizontal 4thgeneration project,Sci-Fi,1.595879328,,23-03-2024 04:27
749,54,Other,Student,869,Object-based foreground access,Romance,2.743892423,,13-02-2024 07:40
750,32,Other,Artist,156,User-friendly homogeneous superstructure,Drama,4.529740539,,13-03-2024 23:03
751,50,Male,Student,710,Total full-range moratorium,Romance,2.099911167,Fish high room exactly law bill. Address whose media fish down.,11-07-2024 12:06
752,49,Female,Doctor,785,Proactive dynamic Local Area Network,Action,2.75477882,Loss heart gun keep measure brother return. Act someone charge ago cover decision see.,03-05-2024 09:04
753,53,Other,Teacher,57,Visionary contextually-based encoding,Sci-Fi,2.828261403,,09-03-2024 16:21
754,51,Other,Engineer,570,Centralized client-server attitude,Comedy,2.880694644,Wear civil guess. Their mention soldier end fear citizen. Foot low fill of feeling.,12-02-2024 03:51
755,56,Other,Engineer,827,Synergized heuristic contingency,Action,2.431966958,Moment believe yeah environmental. Onto event growth must might painting left.,28-06-2024 17:14
756,21,Female,Scientist,357,Innovative full-range algorithm,Action,4.61157016,,06-02-2024 15:23
757,30,Female,Scientist,246,Assimilated multi-state collaboration,Sci-Fi,1.252763671,"Everything old social color poor nearly wife. Arm task standard office.
Wish green talk each.",12-07-2024 16:43
758,20,Male,Doctor,291,Open-source intermediate benchmark,Horror,1.930644536,Opportunity land step believe parent possible. Campaign role role everyone off.,10-05-2024 02:30
759,25,Female,Engineer,931,Face-to-face background budgetary management,Action,4.233475853,Time character only. Put better include.,03-03-2024 14:57
760,36,Female,Student,407,Automated grid-enabled ability,Action,1.217369613,Interview camera head nice possible question hold. Actually couple reach modern but condition.,02-01-2024 04:33
761,26,Female,Doctor,222,Multi-layered disintermediate hub,Sci-Fi,3.158496705,Leg himself lead north. Reality yes just especially. Market someone soon since clearly others.,22-03-2024 17:39
762,,Female,Artist,310,Organized intangible task-force,Sci-Fi,1.378511209,Day man writer author stop mother. Expert everybody how leader.,19-03-2024 02:43
763,21,Female,Teacher,842,Open-architected tangible secured line,Drama,4.431677412,,29-02-2024 06:05
764,55,Female,Engineer,947,Networked context-sensitive data-warehouse,Comedy,4.192298374,Food part size challenge. Official bring task huge. School Democrat body around.,05-07-2024 19:07
765,57,Male,Student,321,Re-engineered intangible system engine,Drama,1.509359865,Phone compare movie medical think. Avoid professor up.,25-04-2024 09:30
766,47,Other,Doctor,135,De-engineered 24hour forecast,Romance,1.902095189,Factor great beat board buy. Food each factor away send actually girl support.,15-07-2024 22:10
767,33,Female,Artist,800,Persistent user-facing process improvement,Action,3.552327557,Leave start population evidence admit. Stuff talk process may we along.,02-02-2024 02:14
768,49,Other,Doctor,99,Sharable secondary strategy,Comedy,4.088964544,Consider outside again head. Sometimes finally accept.,08-06-2024 07:13
769,21,Female,Engineer,660,Triple-buffered attitude-oriented moratorium,Romance,3.765994426,,26-02-2024 03:52
770,25,Male,Artist,377,Operative zero tolerance paradigm,Sci-Fi,3.65720012,Tend cup after plan choice less camera.,29-04-2024 19:35
771,22,Other,Student,182,Secured holistic synergy,Action,4.854545282,By far health dinner. Reason know red where campaign. Mr child per where.,31-05-2024 09:14
772,41,Male,Doctor,642,Assimilated directional moratorium,Comedy,4.449561908,,29-03-2024 11:11
773,50,Male,Scientist,472,Multi-channeled discrete application,Drama,1.936246823,Debate beautiful one cold there fish. Doctor song miss simply.,05-01-2024 00:19
774,37,Male,Doctor,819,Focused well-modulated system engine,Horror,2.258420878,,28-06-2024 12:23
775,18,Female,Artist,692,Organic clear-thinking complexity,Action,4.081595969,Enjoy unit us. Late former see if.,26-06-2024 00:36
776,57,Other,Engineer,311,Horizontal high-level knowledge user,Romance,,Us away suddenly. Chance little stage bring. Event image beautiful business food push.,24-03-2024 18:04
777,48,Male,Engineer,796,Proactive methodical approach,Action,4.882062304,Decade blue prove east billion share. Eye stay green thousand politics.,20-03-2024 16:18
778,,Male,Artist,478,Universal value-added task-force,Sci-Fi,4.226235779,Yard this save stand generation. Reason all sure.,18-01-2024 01:09
779,22,Male,Artist,295,Ergonomic contextually-based frame,Horror,2.882884131,Them camera throughout animal. Effect read attack.,26-02-2024 13:19
780,46,Male,Engineer,608,Networked asynchronous synergy,Sci-Fi,3.171502521,,01-04-2024 01:53
781,23,Other,Scientist,681,Operative zero-defect capacity,Romance,2.54381144,Direction everybody behavior. Shoulder know huge seek trip himself.,09-07-2024 20:27
782,19,Other,Artist,472,Focused context-sensitive parallelism,Sci-Fi,1.189080473,Marriage hundred begin before. Small person nice soon theory to for.,01-05-2024 11:39
783,54,Other,Teacher,919,Multi-lateral system-worthy circuit,Horror,4.486258935,Rise majority all apply street my. Including myself bit should relationship store this.,10-05-2024 15:30
784,21,Male,Engineer,491,Right-sized fault-tolerant budgetary management,Horror,3.975254505,Look power of trip usually your name.,24-01-2024 20:55
785,21,Other,Scientist,36,Right-sized asynchronous task-force,Horror,4.047374598,His list war nearly system full two. Forget or plan despite clear.,21-02-2024 02:37
786,42,Other,Scientist,503,Enhanced needs-based architecture,Action,4.754383439,Much environmental civil. Race camera read clearly. Work maybe court ask answer probably customer.,20-02-2024 16:04
787,53,Male,Student,869,Innovative hybrid moderator,Drama,1.963738153,May ever agent into friend three. Community administration participant stock local.,22-03-2024 11:46
788,29,Female,Engineer,436,Ameliorated non-volatile capacity,Comedy,4.585616224,Reach property dog address. No tell among chance campaign.,19-02-2024 04:53
789,25,Other,Artist,606,Integrated background frame,Drama,3.809358624,,10-03-2024 05:42
790,32,Male,Student,278,Sharable empowering knowledge user,Romance,4.661113112,,16-06-2024 14:43
791,50,Female,Teacher,721,Quality-focused mobile hub,Romance,4.91999146,Direction soldier establish sense. Pretty catch attack increase benefit.,16-04-2024 05:28
792,37,Male,Artist,352,Face-to-face empowering access,Horror,4.271466403,Hotel attack world night. Religious task small strategy most although development official.,22-06-2024 13:09
793,32,Other,Teacher,978,Cross-group exuding Local Area Network,Romance,1.351181942,Room popular arm them. Into knowledge over keep view. Last bed to paper.,27-05-2024 08:39
794,54,Female,Artist,325,Enhanced mission-critical definition,Action,4.040062427,Decide each might garden. Great fear buy mean clear nation. Ball peace common.,23-02-2024 16:09
795,19,Female,Teacher,828,Organic national infrastructure,Comedy,2.402601447,Leader traditional series under where. Begin suddenly figure within friend.,16-05-2024 21:47
796,44,Male,Doctor,534,Pre-emptive solution-oriented methodology,Sci-Fi,,Perform star however card. Nothing since feeling mother believe heart next. Medical especially lot.,06-07-2024 12:24
797,33,Male,Doctor,137,Re-contextualized fault-tolerant forecast,Sci-Fi,3.397972162,Yet thus style avoid product worry. Listen stay class thought shake approach.,03-06-2024 22:05
798,35,Other,Teacher,151,Polarized national intranet,Romance,1.819532547,Ten yes individual page one be. Born attack at moment door yard nature.,15-06-2024 10:33
799,,Male,Artist,264,Cloned responsive protocol,Action,4.835682728,,03-02-2024 06:25
800,37,Female,Artist,770,Decentralized didactic protocol,Action,4.312922752,,16-07-2024 15:51
801,46,Other,Artist,364,Universal 3rdgeneration concept,Comedy,3.633654732,Shoulder but senior save. Foreign sort budget site consider.,17-07-2024 06:57
802,58,Other,Artist,962,Universal transitional productivity,Action,1.499003953,Fund mouth tax white. Five why add compare.,29-04-2024 18:42
803,47,Other,Artist,818,Fully-configurable national database,Horror,,Than research hotel sport official me. Top color real question write yourself second.,15-05-2024 11:44
804,32,Female,Student,452,Cross-group upward-trending website,Action,1.874950388,South effect draw movie recently design. Not have floor five chair.,15-01-2024 21:34
805,36,Female,Artist,797,Pre-emptive motivating challenge,Sci-Fi,3.651111194,Account side behind to partner. Investment himself call pick four day house.,03-04-2024 09:35
806,46,Other,Teacher,141,Business-focused zero tolerance application,Action,4.135092635,,26-03-2024 06:39
807,58,Male,Student,120,Team-oriented attitude-oriented architecture,Romance,2.648844214,Rest if political million. Life between live before class. Mrs shake national person.,17-06-2024 21:59
808,56,Male,Student,887,Focused contextually-based flexibility,Comedy,1.310011939,Magazine final computer identify anyone. Job probably star suffer realize herself fight.,22-02-2024 12:24
809,52,Male,Student,841,Devolved real-time groupware,Sci-Fi,4.292893493,Sure matter shoulder. Available technology light picture including. Car four rise generation why.,23-01-2024 15:53
810,37,Male,Artist,882,Focused multi-state paradigm,Sci-Fi,3.245500438,,28-01-2024 12:54
811,45,Male,Teacher,151,Virtual regional process improvement,Horror,2.175737423,Star kind nothing draw himself must study.,05-06-2024 16:59
812,19,Male,Engineer,446,Realigned transitional ability,Drama,2.045934515,,22-05-2024 20:16
813,35,Other,Student,509,Expanded dedicated functionalities,Comedy,3.91953757,"Senior often thought free fish.
Of eat help begin east occur receive. View effect ball east sense.",27-02-2024 04:19
814,37,Female,Student,9,Re-engineered discrete moratorium,Comedy,4.093497963,Town pressure rock forget everyone. During need line by official when doctor me.,20-01-2024 00:08
815,40,Other,Student,414,Cloned zero tolerance synergy,Action,1.140469823,Goal measure clear late home likely. Picture why learn position card teacher decision.,09-07-2024 10:34
816,49,Other,Teacher,343,Business-focused system-worthy functionalities,Drama,2.274788574,School here I possible short other. City few learn training talk push.,24-05-2024 10:31
817,34,Other,Doctor,759,Optimized client-driven flexibility,Horror,,Edge then executive. Certainly concern best prove bad would coach. Drive usually move.,14-02-2024 19:38
818,20,Other,Teacher,724,Secured holistic methodology,Action,1.266342199,"Relate learn money fish decade.
Husband behind summer see pick month.",25-03-2024 01:45
819,55,Male,Teacher,727,Organic scalable contingency,Horror,1.553342984,Detail book claim crime.,31-03-2024 13:34
820,24,Male,Teacher,125,User-centric coherent task-force,Sci-Fi,2.691205218,Much fire address shake wrong. Even ball base work number peace.,09-01-2024 19:27
821,33,Male,Artist,843,Re-engineered scalable neural-net,Horror,2.053085249,Fine fish minute billion send choice. Own national sit become gas game sit.,06-07-2024 15:23
822,56,Other,Teacher,629,Distributed regional leverage,Sci-Fi,2.501431919,,03-01-2024 20:59
823,56,Male,Doctor,695,Integrated dedicated system engine,Drama,,Difficult area letter which reveal. Certainly note rest account industry.,08-06-2024 00:25
824,52,Male,Scientist,91,Digitized asymmetric Local Area Network,Comedy,3.089992977,Like resource south conference street degree.,30-01-2024 16:52
825,26,Male,Scientist,472,Future-proofed intermediate instruction set,Romance,1.514801913,Join pretty move own. Learn long quite perhaps court expert. Environmental available her central.,03-07-2024 06:22
826,35,Female,Student,909,Universal tangible infrastructure,Action,1.36803159,,12-03-2024 10:34
827,32,Male,Teacher,98,Enterprise-wide maximized standardization,Horror,3.991781397,Main fish hour beautiful. Must smile director defense.,08-07-2024 18:38
828,36,Other,Artist,679,Front-line encompassing model,Drama,4.684576807,Eat camera property hundred form perhaps trip. Main myself speak quite.,26-06-2024 01:18
829,33,Male,Student,597,Persevering object-oriented matrix,Romance,3.818954598,"Policy per expert.
Current poor south century teach customer. Student let do among member yard.",05-04-2024 07:49
830,46,Male,Teacher,949,Inverse cohesive database,Action,4.893255189,Lose lead attack if walk security. Star ten war movement member writer body everyone.,08-04-2024 00:45
831,46,Other,Engineer,899,Automated 3rdgeneration encoding,Drama,2.29589296,May exist growth drug. Sell themselves threat.,30-04-2024 21:41
832,42,Female,Engineer,104,Reactive eco-centric hardware,Horror,4.655384979,,06-06-2024 03:11
833,19,Female,Engineer,190,Multi-layered asymmetric task-force,Comedy,2.784452545,Sea executive begin agent point rich voice. Stand certain person carry peace.,08-05-2024 08:33
834,53,Other,Scientist,739,Centralized client-driven firmware,Sci-Fi,3.679254877,Go short image war mother research. Republican image some.,29-05-2024 01:03
835,49,Female,Teacher,273,Progressive bandwidth-monitored leverage,Comedy,,Not probably baby building again follow professional. Important total popular stage.,13-03-2024 07:15
836,35,Male,Doctor,507,Object-based radical knowledge user,Action,,,20-06-2024 04:19
837,19,Male,Doctor,752,Function-based bifurcated encryption,Comedy,2.358730012,,05-01-2024 19:00
838,33,Other,Engineer,248,Horizontal content-based protocol,Drama,2.009389533,,01-02-2024 21:33
839,33,Male,Doctor,818,Business-focused needs-based groupware,Romance,,Free plant relate bag produce light.,20-01-2024 09:43
840,50,Other,Artist,268,Re-engineered composite superstructure,Romance,2.207985198,,14-01-2024 06:02
841,46,Male,Engineer,995,Intuitive discrete groupware,Comedy,2.691816361,,30-06-2024 02:31
842,36,Female,Scientist,176,Compatible hybrid utilization,Romance,2.099444173,Past husband pressure performance. Stage identify find family allow big.,03-07-2024 18:03
843,45,Other,Student,176,Optimized stable projection,Romance,2.647699371,Maintain teacher low table agreement. Mrs wear red election.,10-03-2024 01:40
844,43,Other,Engineer,981,Adaptive multi-state hub,Drama,1.691862527,Give around certainly final. Under view hard gun. Each performance fine staff apply series.,08-04-2024 01:41
845,54,Male,Scientist,891,Cross-platform executive framework,Action,1.20625282,Field body third Congress attack. Cost hear soldier method.,26-06-2024 07:23
846,39,Other,Scientist,419,Persevering 24/7 infrastructure,Comedy,2.830308408,Call exactly keep knowledge future pressure year.,07-02-2024 22:41
847,25,Male,Engineer,635,Configurable human-resource alliance,Drama,2.995533714,,06-05-2024 09:09
848,51,Male,Teacher,683,Polarized zero administration focus group,Horror,1.766511731,Improve parent nature piece six response. Manage attorney who agent tax.,06-04-2024 19:28
849,28,Female,Artist,966,Realigned regional middleware,Horror,2.975743991,Our cause design in you staff consider instead. Develop detail improve difficult easy statement.,03-06-2024 00:25
850,25,Female,Engineer,900,Organic system-worthy focus group,Sci-Fi,2.066106609,Than team ahead difference decide. Investment foot lose those medical save sort society.,08-03-2024 01:19
851,56,Female,Scientist,126,Right-sized incremental matrices,Horror,4.339071377,,24-04-2024 04:57
852,49,Male,Student,476,Re-contextualized global structure,Comedy,,Effect value half notice star.,13-06-2024 12:26
853,52,Male,Teacher,572,Ameliorated bandwidth-monitored function,Sci-Fi,4.144085103,Food man table probably candidate similar system. Watch thousand deep total I send parent.,11-07-2024 12:55
854,,Male,Student,65,Mandatory web-enabled Graphic Interface,Horror,2.090822556,Agreement morning head practice member trial.,06-03-2024 17:35
855,20,Male,Teacher,952,Up-sized empowering portal,Drama,4.144348703,Never apply test rich. Sit picture edge group nothing top.,22-05-2024 21:01
856,28,Female,Teacher,86,Secured 3rdgeneration matrices,Drama,1.697056095,Ever work tend individual. Lot sport level account allow interest. Consumer call daughter series.,23-02-2024 11:39
857,50,Other,Engineer,990,Future-proofed object-oriented support,Drama,4.676637945,Hear hospital want arrive. Animal when fly town. With fight gas expert bring he.,19-06-2024 14:52
858,47,Female,Engineer,971,User-centric leadingedge functionalities,Horror,2.801051883,Health truth none keep right data trade. Fish level dream son action gas would.,18-04-2024 03:08
859,53,Male,Scientist,445,Implemented bi-directional artificial intelligence,Action,1.737932528,Fast clear most answer. Term painting thousand section successful call. Piece open back fund.,11-05-2024 16:16
