UserID,Age,Gender,Occupation,MovieID,MovieTitle,Genre,Rating,ReviewText,Timestamp
1,34,Female,Doctor,704,Triple-buffered systematic focus group,Action,4.041126584,Act writer realize right tonight particularly region.,03-01-2024 20:46
2,36,Male,Teacher,659,Profound incremental workforce,Comedy,3.767149711,Evidence American front. Deep major second because range color local. Bed offer parent wife.,08-01-2024 23:18
3,22,Other,Teacher,590,Synergistic intangible initiative,Action,1.78046916,Keep exactly notice wear every. Box after student away response any black. Bank necessary protect.,31-05-2024 14:15
4,46,Female,Doctor,394,Monitored scalable collaboration,Comedy,2.238033942,Trade full least method reach. Career provide end.,14-01-2024 06:59
5,37,Female,Engineer,142,Multi-layered exuding productivity,Sci-Fi,2.491654801,White science social customer suddenly. Young soon party notice another something senior actually.,10-03-2024 01:35
6,23,Other,Student,370,Up-sized optimal website,Romance,4.058195293,Message mind should five public.,11-01-2024 20:56
7,46,Male,Doctor,309,Open-architected optimizing focus group,Sci-Fi,1.325633432,Wall seem need keep guy. Decide already art staff through. Outside rock mind thing.,20-06-2024 13:33
8,34,Female,Doctor,78,Configurable local application,Sci-Fi,2.190957197,Free night between all. Sister street very personal course training.,08-07-2024 09:47
9,38,Other,Doctor,213,De-engineered foreground project,Romance,3.392404091,Population popular because it down beyond often couple.,12-07-2024 18:30
10,41,Other,Teacher,377,Cloned bi-directional challenge,Sci-Fi,4.160378659,President protect note level under a do into. Attorney inside pick sea behavior.,25-04-2024 14:25
11,32,Other,Teacher,430,Streamlined secondary conglomeration,Sci-Fi,,,24-05-2024 08:53
12,34,Female,Doctor,866,Universal regional knowledge user,Sci-Fi,1.994767619,,30-01-2024 21:40
13,29,Other,Scientist,580,Ameliorated tertiary paradigm,Drama,4.875290588,All husband chair outside bit at themselves. President too author site sound news true.,07-04-2024 21:15
14,35,Female,Engineer,72,Enterprise-wide tangible synergy,Comedy,1.992785777,Consider American official something on measure plan. Run attorney past worker conference.,28-02-2024 22:15
15,,Female,Scientist,240,Focused well-modulated ability,Action,4.06395592,,29-06-2024 22:02
16,,Female,Artist,76,Monitored heuristic info-mediaries,Horror,1.5620111,Itself civil play into provide. Walk what one range.,30-06-2024 13:26
17,52,Female,Student,215,Polarized empowering neural-net,Drama,3.819553538,"Item exist land age performance. Official arrive discussion low.
Modern debate radio leave fall.",02-01-2024 05:39
18,31,Other,Student,318,Implemented high-level capability,Sci-Fi,2.78852468,,11-02-2024 10:20
19,18,Male,Scientist,856,Open-source asynchronous hierarchy,Comedy,3.229150755,Phone although several edge. Enough within such.,29-06-2024 08:31
20,46,Female,Artist,160,Enhanced interactive utilization,Horror,2.648363092,,03-05-2024 13:55
21,39,Other,Scientist,876,Enhanced contextually-based benchmark,Sci-Fi,4.151759133,We plant than newspaper Mrs west.,20-02-2024 05:53
22,21,Other,Student,118,Digitized stable strategy,Action,1.496141076,Accept thought head Mr charge beyond heart friend. Difference pull Democrat politics item.,11-02-2024 19:45
23,20,Other,Scientist,495,Grass-roots bifurcated time-frame,Drama,1.804024503,Again before boy project above important. Find thus enter foreign information.,13-03-2024 14:52
24,21,Female,Artist,375,Re-engineered holistic knowledgebase,Horror,1.053753196,Month sound him red activity. Father Mrs talk surface ask military skin.,24-04-2024 19:48
25,51,Male,Doctor,434,Reduced client-driven matrix,Comedy,4.269371892,Leave anyone then order begin two energy. Never scene sometimes can medical suggest.,06-06-2024 11:47
26,34,Other,Engineer,708,Vision-oriented fault-tolerant focus group,Sci-Fi,4.224729271,Everything especially camera run. Old bag memory whose fire car. Pull effect plan member day tree.,18-02-2024 22:54
27,59,Female,Student,324,Horizontal user-facing function,Comedy,3.038286971,Religious major future bank enjoy whatever. Measure respond write.,11-04-2024 21:46
28,43,Female,Artist,80,Networked dynamic moratorium,Drama,4.135634399,Hour pass need head dinner.,09-02-2024 00:49
29,58,Other,Teacher,969,Customer-focused system-worthy framework,Horror,1.883193987,Court environment live. Have require best Republican able.,25-02-2024 21:48
30,,Male,Doctor,457,Optional systemic hierarchy,Romance,3.470322024,,10-07-2024 21:45
31,,Other,Engineer,245,Switchable systematic superstructure,Romance,1.388173844,,29-02-2024 09:54
32,34,Other,Teacher,488,Robust contextually-based capacity,Action,3.816101746,Present reach wear news give. Country focus us believe scene energy.,15-01-2024 01:07
33,21,Male,Engineer,16,Sharable asymmetric forecast,Horror,2.864170257,Moment month phone. Few join sport space news time.,18-02-2024 06:44
34,34,Other,Doctor,12,Compatible explicit throughput,Horror,3.891313083,,20-02-2024 08:51
35,57,Male,Scientist,365,Operative responsive ability,Comedy,3.628713014,,11-06-2024 14:37
36,55,Female,Artist,757,Polarized attitude-oriented array,Romance,4.675376673,,30-06-2024 07:06
37,40,Male,Engineer,829,Optional bandwidth-monitored circuit,Romance,2.509186604,Feel account friend stand Congress. Long budget skill huge town question think.,24-02-2024 18:31
38,40,Other,Doctor,637,Configurable cohesive capability,Comedy,1.185737621,Have keep power around control of. Government team cultural above say show body yourself.,21-05-2024 03:51
39,29,Male,Artist,691,Business-focused motivating workforce,Horror,1.411765063,Hundred happen true seem bed. Try sign one student design woman worker.,27-03-2024 09:47
40,30,Other,Scientist,521,Programmable regional adapter,Horror,3.758531034,Space on local that spend see. Cut human ask develop executive color she.,30-03-2024 20:05
41,35,Male,Engineer,789,Reactive cohesive capability,Drama,2.924550868,Provide forward both make it. Natural heavy raise since dinner.,09-01-2024 04:21
42,43,Other,Doctor,552,Automated grid-enabled methodology,Sci-Fi,4.769971496,Away them eye money. Yes about mission dog.,15-04-2024 05:21
43,32,Male,Engineer,364,Horizontal directional solution,Comedy,2.546365779,Table others program thank begin. Day him analysis save everything mission read.,05-04-2024 00:22
44,48,Male,Engineer,997,Open-architected heuristic extranet,Comedy,1.405938394,,23-01-2024 04:02
45,26,Other,Doctor,43,Versatile fault-tolerant matrix,Horror,,,23-06-2024 20:23
46,39,Female,Scientist,807,Universal regional core,Comedy,,Hundred spend organization. Everybody security whether also head. Change to short religious bring.,06-03-2024 21:09
47,57,Male,Student,637,Inverse neutral website,Action,2.10419313,,20-03-2024 20:36
48,39,Female,Artist,61,Managed non-volatile toolset,Sci-Fi,3.197920793,Bring blood democratic fly woman. Chance not wall. Detail eat than he goal feeling you forward.,23-05-2024 16:19
49,19,Male,Student,383,Future-proofed bottom-line monitoring,Horror,1.947571346,"Surface system lay choose.
Within maybe skin future policy part move.",18-05-2024 04:49
50,52,Female,Engineer,369,Balanced systemic hardware,Horror,3.733214105,Plant produce where through become shoulder yes. Serious set state experience difference let item.,28-04-2024 15:36
51,40,Other,Artist,571,Reverse-engineered explicit paradigm,Action,3.717755872,,02-04-2024 23:05
52,40,Female,Scientist,679,Up-sized motivating firmware,Comedy,1.080371114,Statement tend design heart create test. Pass some explain decade white able take.,25-04-2024 15:15
53,33,Female,Engineer,137,Right-sized multi-tasking database,Horror,1.609845948,Remember bar catch art.,11-04-2024 03:05
54,54,Other,Engineer,159,Centralized clear-thinking complexity,Action,3.293751469,Peace range since we region long. Fill upon responsibility whether.,02-07-2024 11:26
55,52,Male,Student,133,Optimized heuristic application,Sci-Fi,1.31469846,,07-07-2024 14:31
56,57,Female,Scientist,967,Enhanced optimizing infrastructure,Sci-Fi,1.670754238,Kid treat attention of pressure significant idea. In will well audience nation probably bad.,20-01-2024 12:03
57,25,Male,Artist,856,Front-line didactic open system,Horror,1.707879327,Expert quite author kind eye shoulder song team. End ten save price.,12-03-2024 15:54
58,31,Female,Teacher,175,Centralized coherent toolset,Sci-Fi,2.569901667,Not wall not fine. Best market under everybody. Former ground style require.,13-04-2024 07:35
59,51,Male,Student,127,Organized global capability,Romance,4.446706004,Worry size Mrs else. Capital the trial president kitchen alone. Network long total across.,08-05-2024 02:47
60,25,Female,Teacher,886,Diverse 5thgeneration synergy,Action,4.622092652,House appear camera guess get wait himself be. Pass increase risk opportunity.,18-03-2024 04:18
61,57,Other,Teacher,933,Enterprise-wide dynamic approach,Drama,3.499362542,,05-06-2024 12:37
62,40,Female,Doctor,72,Digitized maximized installation,Sci-Fi,4.524407121,Around Republican start ball. Could seat doctor as. Truth despite environmental.,28-01-2024 17:47
63,56,Female,Doctor,224,Automated hybrid extranet,Action,2.357303039,Health home program. History discuss support remember send.,16-06-2024 21:54
64,49,Male,Engineer,9,Synergistic web-enabled projection,Action,1.169380074,Dinner outside half important. Important day sister teach at of.,06-06-2024 22:32
65,32,Other,Engineer,36,Visionary object-oriented superstructure,Drama,4.304299057,Local local establish range bag health professor. Ahead get goal training while guess.,08-06-2024 10:20
66,,Other,Scientist,24,Team-oriented exuding collaboration,Horror,1.396153691,,11-06-2024 22:56
67,59,Female,Engineer,701,Ameliorated disintermediate hub,Action,1.481192344,"Near fill peace break everyone already wall.
Public reduce last wonder. Set future media.",12-07-2024 20:31
68,43,Other,Teacher,558,Compatible fresh-thinking knowledgebase,Horror,2.293481078,,11-04-2024 13:11
69,44,Female,Teacher,202,Implemented zero tolerance matrix,Romance,4.134695612,Because toward imagine. She them decision investment. Official money study floor yes.,27-03-2024 17:40
70,57,Male,Scientist,404,Team-oriented attitude-oriented knowledge user,Horror,3.510021483,Laugh party east. Method owner by old thing former cup.,26-03-2024 02:02
71,59,Other,Teacher,844,Object-based analyzing framework,Action,3.96125222,Point team would value short build fly image.,10-05-2024 20:49
72,51,Male,Doctor,827,Diverse stable instruction set,Action,3.040014534,Growth raise tough cold. Provide still cultural vote popular do likely.,11-05-2024 05:26
73,33,Male,Artist,870,Multi-tiered grid-enabled monitoring,Action,3.923518488,,27-01-2024 07:21
74,53,Female,Engineer,745,Object-based context-sensitive model,Horror,4.397618983,"Baby reality difficult others wait prepare Democrat.
Study its perform thus worry college everyone.",05-02-2024 08:56
75,44,Male,Student,672,Multi-channeled background protocol,Romance,3.147628286,Usually find account leave brother. Inside which unit wife age trip.,07-01-2024 21:16
76,21,Male,Teacher,246,Enterprise-wide scalable support,Drama,3.32855752,Enough politics at open social more. Give write head.,06-07-2024 19:54
77,,Other,Scientist,51,Universal heuristic structure,Comedy,1.006150032,,11-02-2024 04:59
78,52,Male,Teacher,807,Right-sized secondary support,Horror,2.060709101,,19-06-2024 16:59
79,42,Other,Artist,711,Customizable methodical success,Horror,2.359785018,Mrs finally blood he agent run. Up couple after. Suffer artist evidence.,09-04-2024 18:51
80,24,Female,Doctor,917,Organized cohesive moratorium,Sci-Fi,2.510523755,Physical sing way left who better rather. Left eye later message color only. Cut bit several feel.,21-02-2024 23:31
81,30,Female,Doctor,286,Diverse radical customer loyalty,Sci-Fi,2.06519794,,14-01-2024 17:25
82,38,Male,Engineer,849,Reverse-engineered non-volatile neural-net,Comedy,,,02-05-2024 10:43
83,35,Female,Doctor,547,Ameliorated impactful access,Sci-Fi,4.892572565,Feeling glass her write wish fall ten. Task ahead group memory film need save.,06-07-2024 00:34
84,53,Other,Student,355,Open-architected full-range Internet solution,Horror,4.809207287,Debate to knowledge main. Program factor activity reduce tonight step PM throughout.,03-05-2024 02:31
85,47,Male,Engineer,660,Implemented attitude-oriented database,Horror,3.748216477,,03-04-2024 04:56
86,48,Female,Scientist,186,Synchronized motivating database,Romance,1.729021468,,25-06-2024 16:44
87,55,Male,Student,696,Synchronized cohesive budgetary management,Action,1.715057614,Certain collection by. Everyone risk product gas sit color.,21-02-2024 07:37
88,28,Other,Teacher,685,Expanded analyzing database,Comedy,3.177987018,,01-01-2024 19:20
89,45,Male,Student,672,Future-proofed modular capacity,Comedy,4.620812189,Born listen four ahead girl. Wait old floor really.,23-06-2024 19:58
90,51,Other,Doctor,370,Extended dynamic structure,Sci-Fi,,Bit figure writer pattern. Wide fact join once school like top law.,20-03-2024 12:56
91,19,Male,Teacher,832,Customer-focused optimal project,Comedy,,Responsibility hair short general call. It research major. Throw world manager quality.,19-05-2024 14:31
92,41,Other,Engineer,1,Managed 6thgeneration knowledge user,Drama,1.738428671,Impact it address much near certain. Television certain young available.,31-01-2024 09:10
93,38,Male,Teacher,393,Optional client-server circuit,Drama,,Anything generation old.,26-04-2024 09:01
94,18,Female,Student,197,Re-contextualized interactive challenge,Comedy,,Past two my picture if nearly.,06-02-2024 16:13
95,36,Male,Artist,850,Optional modular encryption,Comedy,2.680516169,Thing program guy military near child.,18-06-2024 12:12
96,28,Male,Teacher,60,Customer-focused secondary database,Action,3.855714092,,23-02-2024 09:33
97,43,Female,Artist,876,Total zero tolerance array,Drama,1.216970896,But land event final. Film game issue.,10-01-2024 15:26
98,,Other,Scientist,262,Ameliorated composite installation,Drama,3.160868722,,23-06-2024 18:00
99,18,Female,Engineer,718,Customizable motivating intranet,Romance,1.118702013,,19-06-2024 02:59
100,35,Male,Scientist,128,Synergized real-time Graphical User Interface,Drama,2.294612056,,20-04-2024 11:43
101,27,Male,Artist,100,Business-focused coherent paradigm,Action,1.432971855,Month sell treat party product white hold. Growth fly collection agree.,05-07-2024 18:30
102,21,Male,Student,519,Re-engineered tangible collaboration,Comedy,1.168056523,Body should six. Including pull forget.,29-05-2024 06:06
103,55,Other,Engineer,772,Automated bandwidth-monitored Graphic Interface,Comedy,4.224398967,Time turn stand specific fight. Fill lay measure fact Democrat.,30-01-2024 16:17
104,45,Male,Engineer,477,Future-proofed non-volatile support,Romance,4.315927819,Back particularly next policy contain. Almost eat real anything whatever before red.,11-07-2024 02:19
105,25,Other,Artist,690,Quality-focused bottom-line project,Horror,2.472857178,Ago recent affect religious whether. Know their still save.,13-04-2024 08:48
106,20,Other,Teacher,227,Diverse next generation intranet,Action,1.711809744,Though house measure responsibility movie. Fund direction nearly fill decision public.,08-04-2024 06:54
107,35,Male,Engineer,429,Ergonomic clear-thinking circuit,Comedy,1.995081202,,14-04-2024 02:09
108,36,Other,Doctor,941,Pre-emptive dedicated knowledgebase,Horror,,Reduce pretty structure debate finally. Hear pull view other similar huge industry campaign.,19-05-2024 14:21
109,38,Male,Engineer,297,Optional 24hour application,Comedy,2.337880593,"Anything court couple moment.
Main material since article.",08-07-2024 14:03
110,50,Male,Teacher,496,Synergized responsive infrastructure,Romance,2.458904401,Structure put I history. Leg talk toward.,30-01-2024 03:59
111,57,Other,Engineer,917,Enhanced responsive hierarchy,Horror,4.803585831,,05-07-2024 11:44
112,38,Other,Artist,314,Future-proofed bandwidth-monitored matrix,Comedy,3.28770179,On member market table single research. Wife least everyone ahead.,20-01-2024 10:37
113,30,Female,Engineer,167,Future-proofed content-based hub,Comedy,,Several about both knowledge reach. Senior hear fill low campaign control hotel.,02-03-2024 01:49
114,51,Female,Artist,77,Adaptive 5thgeneration application,Comedy,4.964860434,Still perhaps safe. Debate new treat no community travel. Pick until degree could bill cause.,24-03-2024 13:35
115,53,Male,Student,948,Assimilated full-range frame,Comedy,2.217070802,List go hundred box something successful learn. Court because worry purpose do shake.,15-02-2024 22:18
116,33,Male,Artist,628,Intuitive even-keeled leverage,Comedy,2.364707532,,07-03-2024 15:31
117,57,Female,Artist,39,Extended bandwidth-monitored archive,Horror,3.361056125,Partner two store report early practice race. Yeah out world face.,26-03-2024 00:01
118,36,Other,Artist,602,Reduced 24hour monitoring,Sci-Fi,3.273686054,On still surface more large. Option resource consider job. Head citizen Congress civil who little.,27-02-2024 00:40
119,40,Female,Engineer,91,Persevering clear-thinking function,Comedy,4.151299776,Suffer camera have four score. Hold present natural until. Local article treatment report.,01-06-2024 08:34
120,38,Other,Student,125,Business-focused 6thgeneration moderator,Romance,3.238274614,Deal science opportunity where other. Evening end man edge ability perhaps.,02-05-2024 06:16
121,29,Female,Student,210,Optional logistical synergy,Action,1.919531836,Thought well standard us family leg job.,14-04-2024 01:52
122,26,Other,Artist,150,Front-line 24/7 monitoring,Comedy,4.502698985,,22-01-2024 11:25
123,24,Other,Scientist,450,Fundamental executive emulation,Horror,4.312958807,,16-05-2024 19:40
124,41,Female,Teacher,316,Mandatory regional circuit,Horror,1.639471571,Better material policy consumer card mother. Dream sort program benefit article make poor project.,16-03-2024 08:47
125,59,Male,Artist,866,Quality-focused needs-based artificial intelligence,Action,3.643260764,Political small television pressure ask. Report pressure foot push language style sure.,07-05-2024 13:34
126,32,Female,Teacher,97,Automated upward-trending initiative,Action,1.936616851,Forward politics Republican great current along. Effort or avoid possible.,02-05-2024 08:59
127,57,Female,Teacher,353,Programmable heuristic algorithm,Comedy,4.727624771,Keep baby cost. Fight TV perhaps nothing.,20-05-2024 07:50
128,47,Other,Artist,119,Up-sized fault-tolerant functionalities,Action,4.680369227,Quickly apply person yourself knowledge window even. Upon miss whose mission various use how by.,25-06-2024 12:00
129,,Other,Scientist,194,Grass-roots secondary task-force,Action,2.045395617,Guy enter whatever. Impact here try table newspaper student. Compare six baby job.,27-01-2024 19:33
130,32,Other,Scientist,363,Digitized leadingedge capability,Horror,2.087780624,Executive notice guy. Serious significant grow any base. Past happy manage whose add.,19-05-2024 15:18
131,54,Male,Teacher,94,Assimilated modular instruction set,Drama,1.289148429,Sit one cause money.,04-06-2024 09:33
132,39,Other,Engineer,676,Networked systematic process improvement,Comedy,,,17-04-2024 04:49
133,59,Male,Scientist,979,Triple-buffered next generation parallelism,Horror,2.445541456,Ball discuss hear bank when about until. Show ago who free trouble American morning.,18-01-2024 15:09
134,,Other,Student,775,Universal optimizing hierarchy,Romance,1.728345512,Quite senior friend ever. Worker eight next level article agent war support.,06-03-2024 23:10
135,18,Male,Doctor,484,Implemented fresh-thinking groupware,Comedy,2.563777446,Hotel population appear man doctor everybody summer since.,12-02-2024 09:28
136,51,Female,Student,591,Ameliorated web-enabled workforce,Sci-Fi,1.298938517,,21-04-2024 01:12
137,54,Female,Doctor,949,Fully-configurable uniform portal,Action,1.072576191,Single everybody dark yeah central could.,18-05-2024 12:40
138,57,Male,Teacher,355,Monitored analyzing productivity,Romance,3.765139961,Gas similar road still stay because by. Space move special key size rate.,12-06-2024 23:02
139,29,Female,Student,995,Configurable fresh-thinking help-desk,Horror,1.371227663,,02-07-2024 00:59
140,33,Other,Artist,980,Implemented 3rdgeneration support,Horror,,Success drop lawyer threat. Response red role focus out.,13-05-2024 12:31
141,25,Female,Teacher,913,Progressive multimedia service-desk,Sci-Fi,4.112737593,Important religious low serve head while stand. Then color way issue ground town.,09-04-2024 10:50
142,,Male,Doctor,343,Customer-focused stable model,Drama,4.169742666,Price image sit free including. Time north where I set middle.,10-07-2024 09:59
143,53,Female,Scientist,682,Mandatory encompassing process improvement,Sci-Fi,1.838161149,Add trip the detail play. Room else word size stand whose. Recent amount fall theory professor.,26-01-2024 13:17
144,18,Male,Scientist,405,Fundamental well-modulated Local Area Network,Sci-Fi,3.37986234,,22-03-2024 18:41
145,,Male,Doctor,545,Multi-channeled mission-critical groupware,Romance,2.940895761,Market name fast ago. Politics middle by reduce well low television. Particular work however.,27-06-2024 20:11
146,33,Other,Doctor,799,Programmable encompassing moderator,Drama,4.370275207,Child find worry although everybody.,17-02-2024 03:51
147,19,Other,Doctor,538,Reduced coherent superstructure,Action,4.897277593,Certainly truth affect sure. Perform believe according away better become adult.,28-04-2024 10:25
148,57,Female,Engineer,18,Focused responsive open system,Sci-Fi,2.209142853,,25-03-2024 13:26
149,18,Female,Doctor,647,Robust 6thgeneration open architecture,Action,3.812941563,,03-01-2024 09:18
150,54,Female,Scientist,672,Assimilated intangible product,Horror,4.734495473,Lead a teach attention half.,14-06-2024 12:50
151,51,Male,Scientist,577,Centralized explicit system engine,Comedy,3.632488822,,19-05-2024 18:51
152,29,Male,Teacher,294,Visionary user-facing moratorium,Comedy,1.545389869,Police product sometimes argue. Worker finish deep across law.,18-02-2024 12:31
153,35,Male,Scientist,66,Switchable full-range software,Comedy,4.446767856,Stand as him car appear arrive church right. Mr agent benefit effect end just.,25-05-2024 07:35
154,44,Female,Doctor,735,Face-to-face empowering concept,Horror,2.591195815,,09-06-2024 21:57
155,49,Male,Teacher,349,Self-enabling composite pricing structure,Sci-Fi,2.448544019,Amount race coach both animal church. Project major trade family produce government and.,01-03-2024 09:02
156,18,Other,Doctor,545,Centralized responsive collaboration,Sci-Fi,3.424297975,,19-01-2024 04:14
157,34,Other,Engineer,603,Right-sized cohesive archive,Romance,3.516240643,Collection sing six name. List guy five anyone center response last computer.,31-05-2024 14:18
158,37,Other,Scientist,230,Innovative full-range ability,Romance,4.762679697,,11-02-2024 05:39
159,39,Female,Engineer,558,Horizontal hybrid product,Drama,4.218084559,Dark approach purpose. Add country more any. Sort pull fund bit if night.,01-07-2024 20:55
160,51,Male,Student,461,Expanded maximized matrix,Sci-Fi,1.733218277,Argue without Republican number source debate. Win she effort would.,19-04-2024 00:49
161,46,Other,Artist,43,Universal exuding alliance,Drama,2.870179818,How five mouth budget draw year relationship. Road state decide whom.,30-06-2024 15:04
162,19,Other,Student,897,Profound local solution,Romance,3.581973135,Stand view sense art rich. Nor design move card table write PM.,16-04-2024 00:53
163,47,Female,Artist,860,Self-enabling directional concept,Comedy,2.676796322,And himself should which choose. Street security receive claim couple.,02-02-2024 11:30
164,40,Male,Scientist,732,Persistent eco-centric neural-net,Comedy,1.531943476,Note kind spend college fire prove. Late have radio least behavior matter agency.,04-07-2024 06:45
165,45,Male,Scientist,807,De-engineered attitude-oriented Internet solution,Horror,4.266600738,"Specific require tonight sort accept political.
Mother recent fire employee it loss election.",08-02-2024 22:50
166,59,Male,Engineer,477,Public-key radical intranet,Comedy,3.836135436,,08-06-2024 01:11
167,31,Female,Student,208,Upgradable zero administration knowledgebase,Action,3.377671934,Put finish skill three. Decide upon political individual carry. Available when two.,13-07-2024 09:29
168,55,Female,Teacher,843,Multi-channeled non-volatile contingency,Action,1.66764439,,04-02-2024 14:34
169,23,Other,Teacher,405,Polarized holistic interface,Comedy,2.473293747,Something interview coach base together. Herself I call education your similar such.,29-06-2024 17:40
170,41,Female,Teacher,566,Self-enabling high-level database,Romance,2.051414729,South activity Mrs player increase sound anyone matter. Likely billion popular say enter.,05-03-2024 09:22
171,56,Male,Teacher,414,Proactive context-sensitive function,Sci-Fi,2.622151613,,14-06-2024 09:29
172,50,Female,Student,947,Reactive encompassing approach,Sci-Fi,4.651030882,"Describe song relationship somebody population boy.
Note collection statement back car necessary.",15-05-2024 17:16
173,59,Male,Scientist,447,Virtual 5thgeneration array,Drama,3.151542851,Throughout question another per where. Represent turn perform line. Talk off scene PM.,23-03-2024 15:12
174,37,Other,Engineer,508,Cross-platform asynchronous hierarchy,Action,1.217845336,When whether control share half whose. Watch shake rule guess make point item nation.,08-07-2024 11:55
175,30,Other,Teacher,211,Open-architected explicit Internet solution,Sci-Fi,3.097301323,Conference stand consider here us yes future. Agree none industry learn then new likely.,29-01-2024 20:15
